id,source,url,headline,abstract,img_url,publish_time
tmtpost_news|8040274,tmtpost_news,https://www.tmtpost.com/8040274.html,左手专业版，右手AI打车，豆包Agent意欲何为？,生活与生产，豆包Agent的两条主线。,https://images.tmtpost.com/uploads/images/2026/06/20260625125236780.png,2026-06-25 13:01:00
x_tweets|2070008635418083532,x_tweets,https://x.com/sama/status/2070008635418083532,"Nicole from class of 09 would have a field day bullying the online right into roping, wouldn't she? I can imagine her getting banned by jack's twitter for bullying charlie kirk or candace owens or jordan peterson offline.",,,2026-06-25 12:58:12
x_tweets|2070007586762473526,x_tweets,https://x.com/sama/status/2070007586762473526,"There is absolutely no reason for you, as a man, to no have normie social media with your face and name attached to it. If you get doxed and jailed for your numerous crimes you can become like the tate brothers.",,,2026-06-25 12:54:02
x_tweets|2070003484561433077,x_tweets,https://x.com/amasad/status/2070003484561433077,"RT @_ZachFoster: we only know about a fraction of Israeli atrocities because Palestinians know if they speak out they’ll punished, arrested…",,,2026-06-25 12:37:44
qbitai_news|438351,qbitai_news,https://www.qbitai.com/2026/06/438351.html,马斯克预测GLM明年Q1追平Fable，智谱唐杰：没那么久,互利共赢的生态繁荣,https://www.qbitai.com/wp-content/uploads/2026/06/9714f73ec373bf6d3460d26f140aa960.png,2026-06-25 12:35:18
qbitai_news|438336,qbitai_news,https://www.qbitai.com/2026/06/438336.html,不靠单款爆款吃红利，中国AI应用首现3亿ARR独角兽！腾讯顺为红杉继续加码,中国AI应用公司并没有停留在追赶全球浪潮,https://www.qbitai.com/wp-content/uploads/2026/06/79eb8333aeadca526da2d29871e414fd.png,2026-06-25 12:29:49
x_tweets|2070001110866354345,x_tweets,https://x.com/rauchg/status/2070001110866354345,"AI will bring forth an unprecedented surge in entrepreneurship. From 'solopreneurs,' to the revitalization of the small &amp; medium business segment, to the emergence of the largest companies of our times… providing the foundation of it all.",,,2026-06-25 12:28:18
wscn_news|3775468,wscn_news,https://wallstreetcn.com/articles/3775468,瑞银发现：60%已开始控制AI支出，企业转向低成本模型与开源中国模型,"瑞银调研显示，约60%企业已为Token使用加设护栏，有公司单用户单月花费3.5万美元，有团队Token用量超配额200%。企业的应对策略是""模型路由""，简单任务转向低价甚至中国开源模型。高端模型收入增速承压，软件公司站在""被砍预算""与""成为省钱工具""的岔路口，AI增长逻辑未变，斜率之争才刚开始。",https://wpimg-wscn.awtmt.com/e196925c-ec35-4ee4-9869-3dd22ba3df15.jpeg,2026-06-25 12:25:40
x_tweets|2069996867627393467,x_tweets,https://x.com/petergyang/status/2069996867627393467,"Is Widow's Bay worth watching, I'm not great with jump scares.",,,2026-06-25 12:11:26
wscn_news|3775478,wscn_news,https://wallstreetcn.com/articles/3775478,"美银警告：半导体驱动下，纳斯达克已达""泡沫临界点""",美国银行衍生品团队发出警告，纳斯达克100自3月底累计涨幅约32%，估值压力持续积聚，纳斯达克泡沫风险指标（BRI）已升至0.8关键阈值。美银指出，市场在宏观逆风下的超强韧性，恰是泡沫积聚的典型特征。,https://wpimg-wscn.awtmt.com/0ce464a9-b671-40f1-878a-a93c34317c73.png,2026-06-25 11:59:13
tmtpost_news|8039794,tmtpost_news,https://www.tmtpost.com/8039794.html,实测豆包专业版：我们做了个世界杯动态看板,所以，最低68一个月值吗？,https://images.tmtpost.com/uploads/images/2026/06/20260625104252831.png,2026-06-25 11:58:00
x_tweets|2069992268963135897,x_tweets,https://x.com/petergyang/status/2069992268963135897,Claude Design is pretty great. I gave it a repo for a mobile app I'm building and it reproduced the screens perfectly. Except after one prompt it's telling me to save tokens already 😅 https://t.co/k6hQ53zmFN,,https://pbs.twimg.com/media/HLoW-OQacAAyikH.png,2026-06-25 11:53:10
wscn_news|3775481,wscn_news,https://wallstreetcn.com/articles/3775481,Q3存储涨幅超预期，HBM盈利能力明年追上通用DRAM，野村接连上调海力士和三星目标价,将三星目标价从59万韩元上调至67万韩元后，野村再将SK海力士目标价从400万韩元上调至470万韩元。核心驱动是三季度DRAM涨价预期从此前约5%大幅跳升至24%，远超市场预期；此外，HBM因利润率仍比通用DRAM低约30个百分点，要追平盈利能力HBM需要涨价超100%，而2027年有望实现。,https://wpimg-wscn.awtmt.com/dadfdfda-c029-4312-b18f-b451fe72383c.png,2026-06-25 11:50:38
kr36_news|3867998907667462,kr36_news,https://36kr.com/p/3867998907667462,主题圆桌：当所有人都看到泡沫，机器人何时走入真实场景 | 36氪WAVES2026新浪潮,具身智能落地前景圆桌讨论：各方谈场景、投资与进展。,"https://img.36krcdn.com/hsossms/20260625/v2_2352f4be5eea4f4f9c5b4e0a2b2e27e3@6381723_oswg911811oswg1053oswg495_img_png?x-oss-process=image/resize,m_mfit,w_600,h_400,limit_0/crop,w_600,h_400,g_center",2026-06-25 11:42:26
x_tweets|2069986953987289188,x_tweets,https://x.com/petergyang/status/2069986953987289188,"RT @petergyang: I love using Hermes from @NousResearch as my 24/7 AI chief of staff because it's reliable, free, and open source. Here's m…",,,2026-06-25 11:32:02
wscn_news|3775477,wscn_news,https://wallstreetcn.com/articles/3775477,英特尔背书，AI芯片新秀SambaNova估值或达百亿，四个月内暴涨五倍,"推动本轮估值跃升的关键催化剂之一，是SambaNova与英特尔及Vista Equity Partners的一系列合作落地。英特尔持有SambaNova约9%的股权，同时也是其客户。Vista Equity Partners与其合作打造云服务商，带来35亿美元收入承诺。公司核心优势在于RDU芯片能耗仅为英伟达GPU的十分之一，定位从""替代者""转向""协同者""。",https://wpimg-wscn.awtmt.com/a5e025a3-bdae-4592-a8ae-44045b6f0918.png,2026-06-25 11:26:42
wscn_news|3775474,wscn_news,https://wallstreetcn.com/articles/3775474,美光财报炸裂，海力士IPO火爆，存储芯片成AI“夜空中最亮的星”,美光科技季度财报大超预期，用炸裂的业绩夯实了对存储芯片的信仰。此外SK海力士披露赴美上市计划，拟募资约294亿美元，两大利好推动亚洲存储股集体上涨。存储股今年涨幅远超英伟达，行业从2023年巨亏泥沼实现戏剧性逆转，成为资本市场最炙手可热的AI赛道。,https://wpimg-wscn.awtmt.com/11ef050f-6cfd-44a9-a84e-60f66963dd39.jpeg,2026-06-25 11:21:14
tmtpost_news|8039925,tmtpost_news,https://www.tmtpost.com/8039925.html,世界模型不是错了，是太早被卖贵了,"半年融掉几百亿，人人都说自己""全球第一""。但热钱涌进来的时候，最该问的不是要不要上车，而是一个朴素的商业问题：钱，最后从哪儿挣回来？这不是一篇否定世界模型的文章——方向我信，我质疑的是它当下的价格。",https://images.tmtpost.com/uploads/images/2026/06/20260625105328846.png,2026-06-25 11:01:00
kr36_news|3867974334714888,kr36_news,https://36kr.com/p/3867974334714888,往 Codex 里塞块无限画布，AI 改图终于能指哪打哪了,Codex 正在变成打工人的 AI「工作台」,https://img.36krcdn.com/hsossms/20260625/v2_cda0b3a11a234e6e9759fb7de4ccc6e5@5091053@ai_oswg954579oswg1053oswg495_img_png~tplv-1marlgjv7f-ai-v3:600:400:600:400:q70.jpg,2026-06-25 10:56:17
kr36_news|3867956840184705,kr36_news,https://36kr.com/p/3867956840184705,agent进驻工作群，我们给豆包支的招，Claude听进去了,LLM的第三次革命，AI牛马直接在群里上班。,https://img.36krcdn.com/hsossms/20260625/v2_b0a7a6b3528742a7aec0526c17d850e4@5091053@ai_oswg965080oswg1053oswg495_img_png~tplv-1marlgjv7f-ai-v3:600:400:600:400:q70.jpg,2026-06-25 10:55:51
x_tweets|2069976538238624125,x_tweets,https://x.com/amasad/status/2069976538238624125,"RT @washingtonpost: An independent U.N. commission said that the Israeli military had deliberately targeted children in Gaza, amounting to…",,,2026-06-25 10:50:39
x_tweets|2069976427785850897,x_tweets,https://x.com/swyx/status/2069976427785850897,RT @eve_bouff: https://t.co/N9fhuSScc1,,https://pbs.twimg.com/media/HLhtKjCasAAWX-S.jpg,2026-06-25 10:50:13
wscn_news|3775470,wscn_news,https://wallstreetcn.com/articles/3775470,美光财报炸裂，韩股领涨亚太股市，海力士飙升10%、三星大涨5%，黄金跌破4000，白银再跌1%,韩国综指一度涨逾6%，触发熔断。受到赴美上市计划催化，SK海力士盘中大涨逾10%，三星电子一度上涨超5%。日经225指数一度涨幅达3%。WTI原油跌约1.6%至每桶69.19美元。此外，美元走强令黄金承压，现货金价跌至约3983美元/盎司，再次跌破4000美元关口。现货白银下挫超1%，报56.78美元。,https://wpimg-wscn.awtmt.com/81a9f0ad-1fb2-4acd-b3dc-907f80c632c4.png,2026-06-25 10:49:51
x_tweets|2069976109844762691,x_tweets,https://x.com/sama/status/2069976109844762691,"RT @Garbagestyleman: End rural broadband access, now.",,,2026-06-25 10:48:57
x_tweets|2069975251476422664,x_tweets,https://x.com/levie/status/2069975251476422664,"There are some subtleties in this launch that are very important in practice. This isn’t just you interacting with Claude in a 1:1 format via Slack. In this case, Claude acts as a coworker that any user can tap into in a shared way. We’ve already seen some agentic coding systems start to adopt this pattern (as well as OpenClaw and Hermes), and doing it for general purpose knowledge work continues to push the idea forward. As a result, what this means is that this agentic coworker needs its own set of resources, access to tools, and data to work with. This is not the same as you giving it access to your personal resources and tools, because the agent then could accidentally then share those out with anyone. The agent needs to instead be like any other user in the system, and you need to be thoughtful about what it should have access to, and make sure its information that is safe to share with that group. When you can pull that off, it’s quite powerful. For instance, by connecting to Claude Tag to Box, you could have Claude access corporate sales materials for questions in sales conversations or generating RFPs, brand guidelines and marketing assets for campaign creation, product roadmap materials and product documentation for coding agents to use, contracts that anyone in the legal team can access, and more. But this is just the Box example. You can equally have it access your product or customer analytics data, CRM information, codebase, and other resources and agents that would make sense to work on in a collective manner. It’s awesome to see continued innovation in what the future of work may begin to look like with agents.",,,2026-06-25 10:45:32
x_tweets|2069974525727650112,x_tweets,https://x.com/trq212/status/2069974525727650112,"RT @petergyang: Ok, I am interviewing the legend @trq212 on Friday. I'm planning to ask him to show me: → His Claude Code setup and how he…",,,2026-06-25 10:42:39
kr36_news|3867915449488644,kr36_news,https://36kr.com/p/3867915449488644,80%代码由Claude合并，Anthropic内部人员点破Agent真相：「Close the Loop」,别再用「去年」的方式测试「今天」的Claude！,https://img.36krcdn.com/hsossms/20260625/v2_8d95a9a14d9b45d08acbeca11ef5abd1@5091053@ai_oswg972928oswg1053oswg495_img_png~tplv-1marlgjv7f-ai-v3:600:400:600:400:q70.jpg,2026-06-25 10:34:35
tmtpost_news|8039710,tmtpost_news,https://www.tmtpost.com/8039710.html,实测专业版豆包，68块值不值？,豆包也想赚钱了。,https://images.tmtpost.com/uploads/images/2026/06/20260625102953437.png,2026-06-25 10:30:31
x_tweets|2069970148199670181,x_tweets,https://x.com/garrytan/status/2069970148199670181,"RT @ycombinator: Brooke Hopkins (@bnicholehopkins) is the founder and CEO of @covaldev, a simulation and observability platform that helps…",,,2026-06-25 10:25:16
kr36_news|3867935073080327,kr36_news,https://36kr.com/p/3867935073080327,AI软递归自我提升，Hassabis夜不能寐：人类已至奇点山脚,软递归自我提升已实现，哈萨比斯夜不能寐！,https://img.36krcdn.com/hsossms/20260625/v2_a32d03a6c7e74af4889a72f9d9d37c45@5091053@ai_oswg1019852oswg1053oswg495_img_png~tplv-1marlgjv7f-ai-v3:600:400:600:400:q70.jpg,2026-06-25 10:24:39
qbitai_news|438297,qbitai_news,https://www.qbitai.com/2026/06/438297.html,聚焦GW级Token工厂，解码下一代算力底座｜6月30日，深圳,谁将定义下一代算力基础设施？谁又能在Token时代占据产业制高点？,https://www.qbitai.com/wp-content/uploads/2026/06/6a94031d9160e7887a5d5db7d10e9a98-e1782353019950.png,2026-06-25 10:22:43
tmtpost_news|8040022,tmtpost_news,https://www.tmtpost.com/8040022.html,微信AI不够好，但很张小龙,所有人都看到了小微能做什么。但更值得留意的，是小微选择不做什么。,https://images.tmtpost.com/uploads/images/2026/06/20260625100459125.png,2026-06-25 10:13:19
x_tweets|2069964772003770673,x_tweets,https://x.com/swyx/status/2069964772003770673,"lots of folks prepping talks next week (congrats!). Some thoughts from RLing on thousands of hours of engineer- and researcher- focused talks: - AI generated svgs > AI generated imgs. MAXIMUM 4 ai slop images in your slides, I don't care how pretty your mom thinks they are (exception ofc if your talk is ABOUT imagegen) - Be pointy. Better to have 1 message with 5 surprising applications, than 5 messages with no concrete examples. - Put code on screen. Engineers like to see code. Especially if they can nitpick it to death over things that aren't the point. - Don't forget to Entertain. Being actually funny, or good at telling relevant anecdotes, is more important than adding yet another bullet point. - Have a Thesis. every talk gets ONE ""if you remember one thing from this talk, it is this"" card. 1) SO MANY PEOPLE DON'T USE IT. 2) SO MANY PEOPLE DON'T PLAN FOR IT. you get one. use it well? - Have a Thesis Slide. you've been in that talk where everyone gets their phone out to take a photo of the slide. Because people see 1000x more images than videos, you are much more likely to have a viral talk/slide if you have a single viral slide. You are much more likely to have a viral slide if you TRY and most people do not TRY. Struggling? Collect examples from talks you like and adapt their format to your thing. Your slides have a power law - don't spend 5% of your time each on 20 slides, spend 80% of your time on 1 slide and have the rest build up to that 1 slide. - You might not need slides. live demo in IDE, off the cuff rambles, pull audience member up to roleplay, do call and response with the audience, sing/perform, voice over vibe videos, I have seen it all. higher risk/effort, higher reward when done well. - Be pleasant to listen to. Talks with bad/no visuals still can be listened to. Talks with bad audio are DOA. Be confident, project, remember vocal variation, evoke emotion. - Design the emotional journey. Start strong, end strong, have a peak aha/laugh/thesis moment in the middle. Everything else is buildup. - Data driven talks are underrated. Present pretty charts and surprising, authoritative numbers. Use the stage authority to infer from the data to support the broader thesis. Done well, it will feel like my obvious conclusion from objectively looking at the data you presented, not you feeding the conclusion to me. - How to shill your product/company without feeling salesy: teach me everything I didn't know I should to know about the problems you solve, and then you shall have earned the right to convince me you are the guys to trust to solve it once and for all. - Actively watch a lot of talks. like with anything you both need a lot of reps AND you need to explore to find the styles/role models that you shine in. Passive = no introspection after watching, just mindlessly autoplay next video. Active = trying to articulate why a talk was good/bad after watching. If you want to REALLY hone it, think about how you feel about a famous talk and then TRANSCRIBE the talks and read the words on the printed page, and then compare with a ""normal"" talk and define rules you will follow for yourself to improve. thanks to @dexhorthy for organizing the AIEWF Speaker prep meetup tonight. we should actually do more of these....",,,2026-06-25 10:03:54
tmtpost_news|8036871,tmtpost_news,https://www.tmtpost.com/8036871.html,机器人进工厂，先过英伟达这一关,机器人时代的第一道收费站。,https://images.tmtpost.com/uploads/images/2026/06/20260625095314467.png,2026-06-25 10:00:35
wscn_news|3775465,wscn_news,https://wallstreetcn.com/articles/3775465,卖飞美光的“印度巴菲特”：拿了六年，2023年清仓后，股价涨了15倍,被称为印度“巴菲特”的帕伯莱曾重仓美光长达六年，清仓后两年股价涨逾15倍，少赚约二十亿美元。SK海力士也同样卖早了。近日，他在媒体访谈中亲口复盘最痛的错误交易：“我曾多次拜访三星，也持有过SK海力士的投资。但非常遗憾，我违反了自己的原则，卖掉了本应永远持有的公司。”,https://wpimg-wscn.awtmt.com/ecfb323f-19a8-4a07-94ed-c854f12636b2.png,2026-06-25 09:59:07
x_tweets|2069962339651096868,x_tweets,https://x.com/sama/status/2069962339651096868,RT @aguycalledjared: You also just don't have to tell people about the stupid shit you said when you were a teenager ngl. It really doesn't…,,,2026-06-25 09:54:14
x_tweets|2069962302229500334,x_tweets,https://x.com/sama/status/2069962302229500334,RT @sardonic_greek: It’s called Hell and I’ve been exploring it both as an artistic concept and an organizing principle,,,2026-06-25 09:54:05
tmtpost_news|8039657,tmtpost_news,https://www.tmtpost.com/8039657.html,从580亿到万亿市值，智谱的半年狂奔,Anthropic关上的门，让智谱打开万亿的窗，而这扇窗背后又是什么？,https://images.tmtpost.com/uploads/images/2026/06/20260625092112384.png,2026-06-25 09:40:00
github_trending|stablyai/orca,github_trending,https://github.com/stablyai/orca,stablyai/orca,"Orca is the ADE for working with a fleet of parallel agents. Run any coding agent with your own subscription. Available on desktop and mobile. Orca Español · 中文 · 日本語 · 한국어 The AI Orchestrator for 100x builders. Run Codex, ClaudeCode, OpenCode or Pi side-by-side — each in its own worktree, tracked in one place. Download Orca Features Mobile Companion Monitor and steer your agents from your phone — get notified when an agent finishes and send follow-ups from anywhere. iOS App Store · Android APK · Docs → Parallel Worktrees Fan one prompt across five agents, each in its own isolated git worktree — compare the results and merge the winner. Docs → Terminal Splits Ghostty-class terminals with WebGL rendering, infinite splits, and scrollback that survives restarts. Docs → Design Mode Click any UI element in a real Chromium window to send its HTML, CSS, and a cropped screenshot straight into your agent's prompt. Docs → GitHub &amp; Linear, Native Browse PRs, issues, and project boards in-app — open a worktree from any task and review without a context switch. Docs → SSH Worktrees Run agents on a beefy remote box with full file editing, git, and terminals...",https://opengraph.githubassets.com/46bcfcea382f1acec958a513f16a9125c6d43809f192dacda89003824ca29623/stablyai/orca,2026-06-25 09:39:16
github_trending|kunchenguid/no-mistakes,github_trending,https://github.com/kunchenguid/no-mistakes,kunchenguid/no-mistakes,"git push no-mistakesgit push no-mistakes Kill all the slop. Raise clean PR. English · 简体中文 no-mistakes puts a local git proxy in front of your real remote. Push to no-mistakes instead of origin, and it spins up a disposable worktree, runs an AI-driven validation pipeline, forwards the branch to the configured push target only after every check passes, and opens a clean PR automatically. Non-blocking - the pipeline runs in an isolated worktree without disrupting your work. Agent-agnostic - claude, codex, rovodev, opencode, pi, or acp:&lt;target&gt; via acpx. Agent-native - /no-mistakes lets your coding agent do a task and gate it, or gate existing committed work: it runs the pipeline, has the pipeline apply safe fixes, and escalates the rest to you. Human stays in charge - auto-fix or review findings, your call. Clean PRs by default - push, open PR, watch CI, and auto-fix failures in one shot. Full documentation: https://kunchenguid.github.io/no-mistakes/ How it works your branch │ git push no-mistakes ▼ ┌──────────────────────────────────────────────┐ │ disposable worktree — your work stays put │ │ review → test → docs → lint → push → PR → CI │ └──────────────────────────────────────────────┘ │ every check green ▼ clean PR, opened for you Each step...",https://repository-images.githubusercontent.com/1201787282/21a7fe5f-6cb8-430c-aef2-7984ecdd7f60,2026-06-25 09:39:16
github_trending|interviewstreet/hiring-agent,github_trending,https://github.com/interviewstreet/hiring-agent,interviewstreet/hiring-agent,"AI agent to evaluate and score resumes.Hiring Agent Resume-to-Score pipeline that extracts structured data from PDFs, enriches with GitHub signals, and outputs a fair, explainable evaluation. Contents Overview Architecture Installation and Setup Prerequisites Quick setup with pip Ollama models Configuration How it works CLI usage Directory layout Provider details Contributing License Overview Hiring Agent parses a resume PDF to Markdown, extracts sectioned JSON using a local or hosted LLM, augments the data with GitHub profile and repository signals, then produces an objective evaluation with category scores, evidence, bonus points, and deductions. You can run fully local with Ollama or use Google Gemini. Architecture Flow pymupdf_rag.py converts PDF pages to Markdown-like text. pdf.py calls the LLM per section using Jinja templates under prompts/templates. github.py fetches profile and repos, classifies projects, and asks the LLM to select the top 7. evaluator.py runs a strict-scored evaluation with fairness constraints. score.py orchestrates everything end to end and writes CSV when development mode is on. Key modules models.py Pydantic schemas and LLM provider interfaces. llm_utils.py Provider initialization and response cleanup. transform.py Normalization from loose LLM JSON to JSON Resume style. prompts/ All Jinja templates for extraction and scoring. Installation and Setup Prerequisites Python 3.11+ The...",https://opengraph.githubassets.com/8afbffe8ca7c8f274289beb85730ce84a581bd68d0507d045bc6b7d16fa1560d/interviewstreet/hiring-agent,2026-06-25 09:39:16
github_trending|google-labs-code/design.md,github_trending,https://github.com/google-labs-code/design.md,google-labs-code/design.md,"A format specification for describing a visual identity to coding agents. DESIGN.md gives agents a persistent, structured understanding of a design system.DESIGN.md A format specification for describing a visual identity to coding agents. DESIGN.md gives agents a persistent, structured understanding of a design system. The Format A DESIGN.md file combines machine-readable design tokens (YAML front matter) with human-readable design rationale (markdown prose). Tokens give agents exact values. Prose tells them why those values exist and how to apply them. --- name: Heritage colors: primary: ""#1A1C1E"" secondary: ""#6C7278"" tertiary: ""#B8422E"" neutral: ""#F7F5F2"" typography: h1: fontFamily: Public Sans fontSize: 3rem body-md: fontFamily: Public Sans fontSize: 1rem label-caps: fontFamily: Space Grotesk fontSize: 0.75rem rounded: sm: 4px md: 8px spacing: sm: 8px md: 16px --- ## Overview Architectural Minimalism meets Journalistic Gravitas. The UI evokes a premium matte finish — a high-end broadsheet or contemporary gallery. ## Colors The palette is rooted in high-contrast neutrals and a single accent color. - **Primary (#1A1C1E):** Deep ink for headlines and core text. - **Secondary (#6C7278):** Sophisticated slate for borders, captions, metadata. - **Tertiary (#B8422E):** ""Boston Clay"" — the sole driver for interaction. - **Neutral (#F7F5F2):** Warm limestone foundation, softer than pure white. An agent that reads...",https://opengraph.githubassets.com/eea8f4cf96c1b4dbfd448a6b6b3d73d8cc3987064fde1d653808609047dc29ab/google-labs-code/design.md,2026-06-25 09:39:16
