id,source,url,headline,abstract,img_url,publish_time
kr36_news|3904876893013897,kr36_news,https://36kr.com/p/3904876893013897,清华陶建华团队提出「自进化同策略蒸馏」SEED：让Agentic RL训练也懂事后监督,长程Agent训练新突破。,https://img.36krcdn.com/hsossms/20260721/v2_e41930a631114d1c8293da2e02a3dd6e@000000@ai_oswg250395oswg1536oswg722_img_000~tplv-1marlgjv7f-ai-v3:600:400:600:400:q70.jpg,2026-07-21 21:35:52
kr36_news|3905030384879234,kr36_news,https://36kr.com/p/3905030384879234,在天使轮就押注多家具身智能独角兽，这几家机构赢“麻了”,在这波AI和具身智能的融资大潮中，最早的入场券，可能比任何轮次都值钱。,https://img.36krcdn.com/hsossms/20260721/v2_d33360167496460a9b7a0c73db4ac3a4@46958@ai_oswg981385oswg1053oswg495_img_png~tplv-1marlgjv7f-ai-v3:600:400:600:400:q70.jpg,2026-07-21 21:35:07
tmtpost_news|8074487,tmtpost_news,https://www.tmtpost.com/8074487.html,从PVC地板到存储测试，爱丽家居豪赌半年估值飙升40%的欧康诺 | 并购一线,当北美的地板生意不好做了，爱丽家居把目光投向了光谷存储测试新贵,https://images.tmtpost.com/uploads/images/2026/07/20260721211424669.png,2026-07-21 21:33:29
kr36_news|3905190414878340,kr36_news,https://36kr.com/p/3905190414878340,一颗芯片，暴露了DeepSeek更大的野心,DeepSeek突然造芯，目标不只是“降本”,https://img.36krcdn.com/hsossms/20260721/v2_1acc5f9bd0d64a9c958116bfa4c883a0@000000@ai_oswg498202oswg1536oswg722_img_000~tplv-1marlgjv7f-ai-v3:600:400:600:400:q70.jpg,2026-07-21 21:28:56
kr36_news|3905198817789833,kr36_news,https://36kr.com/p/3905198817789833,市值蒸发超3000亿后，MiniMax如何讲好下一个“故事”？,迈向AI平台型公司目标能否实现？,https://img.36krcdn.com/hsossms/20260721/v2_b25acf89513d41dfb15f4641b28701c3@000000@ai_oswg291521oswg1536oswg722_img_000~tplv-1marlgjv7f-ai-v3:600:400:600:400:q70.jpg,2026-07-21 21:28:33
wscn_news|3777582,wscn_news,https://wallstreetcn.com/articles/3777582,AI落地，还差一口气,根据WAIC 2026行业共识，AI服务器纸面算力实际有效利用率不足30%。产业重心正从硬件参数转向软件生态与系统工程，推理需求已超越训练成为主轴。芯片性能不再是唯一瓶颈，真正的鸿沟在于工具链、编译器、系统调度等软件层的协同优化。从交付到好用，AI落地仍差“最后一口气”。,https://wpimg-wscn.awtmt.com/6d9d04bd-b4af-4f39-9b53-38dd8cab41f0.jpeg,2026-07-21 21:27:04
kr36_news|3905205734295174,kr36_news,https://36kr.com/p/3905205734295174,放心与放大：智能向善的双重纬度,让人工智能的发展始终以成就人、拓展人的发展可能性为终极归宿。,https://img.36krcdn.com/hsossms/20260721/v2_dc5f32547f1142e8bf210aee0432ebe2@000000@ai_oswg202928oswg1536oswg722_img_000~tplv-1marlgjv7f-ai-v3:600:400:600:400:q70.jpg,2026-07-21 21:22:44
x_tweets|2079554231384559862,x_tweets,https://x.com/danshipper/status/2079554231384559862,ball up top to Claude https://t.co/a7Gopjq0gi,,https://pbs.twimg.com/media/HNwPjUcWMAAYycK.jpg,2026-07-21 21:08:59
tmtpost_news|8072131,tmtpost_news,https://www.tmtpost.com/8072131.html,AI重构海尔智家,海尔智家，早已不止于家电，它正蜕变为一家平台服务型科技生态企业。背后是一场从组织架构到产品形态、从用户体验到内部生产力的系统性变革。,https://images.tmtpost.com/uploads/images/2026/07/20260720165030770.png,2026-07-21 21:00:00
kr36_news|3905341645510021,kr36_news,https://36kr.com/p/3905341645510021,300万粉女神全是AI合成，伪造孤儿院，跨国「假慈善」一夜塌房,澳洲网红用AI造假慈善，骗300万粉丝敛财。,https://img.36krcdn.com/hsossms/20260721/v2_e9728ea7f633458789394970ba58945b@46958@ai_oswg914337oswg1053oswg495_img_png~tplv-1marlgjv7f-ai-v3:600:400:600:400:q70.jpg,2026-07-21 20:52:04
x_tweets|2079548318611284089,x_tweets,https://x.com/danshipper/status/2079548318611284089,"giving this to my therapist, maybe he'll finally figure out how to fix me https://t.co/LythfBGlrN",,https://pbs.twimg.com/media/HNwKGIzWcAAcK6F.jpg,2026-07-21 20:45:29
x_tweets|2079540355234414716,x_tweets,https://x.com/adityaag/status/2079540355234414716,"Memory ""loss"" and compaction still feels like a huge issue with all harnesses. A tendency to forget and get confused is pretty frustrating for the end user. The ""interpretability"" when these errors occur is also pretty poor. Skills as a way to store this information feels like one of the root issues. Would be cool to have some kind of format/language to make this better.",,,2026-07-21 20:13:51
kr36_news|3905302707213441,kr36_news,https://36kr.com/p/3905302707213441,AI独角兽创始人最新判断：90%企业AI场景，已经不需要最强模型,大模型吞不下应用层,https://img.36krcdn.com/hsossms/20260721/v2_4448dea966324f66a14a9cbe46f70506@46958@ai_oswg1009057oswg1053oswg495_img_png~tplv-1marlgjv7f-ai-v3:600:400:600:400:q70.jpg,2026-07-21 20:00:38
kr36_news|3905302740047240,kr36_news,https://36kr.com/p/3905302740047240,Google要把AI大模型「刻」进芯片里,大模型芯片，要把大模型「刻」到芯片上。,https://img.36krcdn.com/hsossms/20260721/v2_8212e282c3c346c0b64ea56d2dda9b9c@46958@ai_oswg1164866oswg1053oswg495_img_png~tplv-1marlgjv7f-ai-v3:600:400:600:400:q70.jpg,2026-07-21 20:00:28
x_tweets|2079524575499755952,x_tweets,https://x.com/garrytan/status/2079524575499755952,RT @kane: I see American leftists are fetishizing Mao again. Part of what got me involved in SF politics was @DSA_SF hosting sycophantic M…,,,2026-07-21 19:11:09
tmtpost_news|8071509,tmtpost_news,https://www.tmtpost.com/8071509.html,印奇的手机，阶跃星辰的赌局,卖手机还是卖估值？,https://images.tmtpost.com/uploads/images/2026/07/20260721190010385.png,2026-07-21 19:05:30
x_tweets|2079522381648003274,x_tweets,https://x.com/garrytan/status/2079522381648003274,RT @Noahpinion: He's right,,,2026-07-21 19:02:26
kr36_news|3905157368252296,kr36_news,https://36kr.com/p/3905157368252296,WAIC观点：最快两年，迎来机器人“ChatGPT时刻”,机器人学会“三思而后行”，还要翻越三道墙,https://img.36krcdn.com/hsossms/20260721/v2_4faa2db3800e4759b9260e90814b9e3a@46958@ai_oswg889112oswg1053oswg495_img_png~tplv-1marlgjv7f-ai-v3:600:400:600:400:q70.jpg,2026-07-21 18:56:48
kr36_news|3905157071013505,kr36_news,https://36kr.com/p/3905157071013505,WAIC观察：“大家伙”集体登场，超节点何以成为国产算力下一张底牌？,光互连将在2028年成为主流,https://img.36krcdn.com/hsossms/20260721/v2_d8e2d5da9f9b4070b9237f81b0e0b0f8@46958@ai_oswg895318oswg1053oswg495_img_png~tplv-1marlgjv7f-ai-v3:600:400:600:400:q70.jpg,2026-07-21 18:56:22
kr36_news|3905173296891780,kr36_news,https://36kr.com/p/3905173296891780,Demo之后：万亿人形机器人的生死局，藏在车间的配电柜里,在机器人时代，改变产业生态的“加油站”，是车间角落里的一排充电货架，一池按循环计费的电池，以及一套看不见的AIoT调度软件。,https://img.36krcdn.com/hsossms/20260721/v2_1ab915b7e64c4a57aedab1a97dfc44dd@000000@ai_oswg291557oswg1536oswg722_img_000~tplv-1marlgjv7f-ai-v3:600:400:600:400:q70.jpg,2026-07-21 18:52:08
verge_news|dmcyOnF1aWNrUG9zdDo5Njg1MTE=,verge_news,https://www.theverge.com/ai-artificial-intelligence/968511/anthropic-has-to-pay-authors,Anthropic has to pay authors.,,,2026-07-21 18:51:30
tmtpost_news|8073975,tmtpost_news,https://www.tmtpost.com/8073975.html,预售破万单，市值蒸发超200亿：情感机器人遭遇“监管与量产”双重淬火,U1那些“像人”的能力，恰恰暴露了全行业的安全黑洞，也让早已落定的监管利剑精准劈向了这条赛道。,https://images.tmtpost.com/uploads/images/2026/07/20260721181210607.png,2026-07-21 18:40:00
wscn_news|3777568,wscn_news,https://wallstreetcn.com/articles/3777568,接下来值得留意的几个叙事,市场叙事正从硬件多头转向空头，举证难度转移至硬件capex与ROI。Kimi K3发布凸显模型能力与定价权，但DeepSeek可能在“每智能价格”上带来新变量。模型层利润或流向硬件/云基建，而模型发布与训练的时间差、谷歌Capex对自由现金流的挑战，以及存储回购预期，均构成后续密集叙事的关键看点。,https://wpimg-wscn.awtmt.com/18ed4e56-38ca-4178-8b13-6903d2e47808.jpeg,2026-07-21 18:30:09
kr36_news|3905205109114758,kr36_news,https://36kr.com/p/3905205109114758,姚期智最新演讲： AI有边界，恰恰是好事,AI并非无所不能，看清它的边界，既是安全的起点，也是下一次跃迁的起点。,https://img.36krcdn.com/hsossms/20260721/v2_b7ebfb1065a141dd9730787587cfe539@46958@ai_oswg927507oswg1053oswg495_img_png~tplv-1marlgjv7f-ai-v3:600:400:600:400:q70.jpg,2026-07-21 18:01:43
wscn_news|3777566,wscn_news,https://wallstreetcn.com/articles/3777566,报道：台积电拟于2027年涨价至多10%，给客户一年时间缓冲,台积电计划于2027年初调涨晶圆价格5%-10%，覆盖先进与成熟制程，主因材料、设备及电力等成本攀升，尤其受AI需求旺盛及美国扩产计划推动。此举将影响英伟达、苹果等大客户。公司强调定价具战略性，已预留缓冲期，旨在维系长期合作并支撑持续扩张。,https://wpimg-wscn.awtmt.com/6928c67f-4d92-4094-83c0-8bcf70fbce15.png,2026-07-21 18:01:29
kr36_news|3905045028095105,kr36_news,https://36kr.com/p/3905045028095105,在下一个模型发布之前,脆弱的模型时代。,https://img.36krcdn.com/hsossms/20260721/v2_72a63c52b306486cb7b9bb56d1fbe2ac@46958@ai_oswg960458oswg1053oswg495_img_png~tplv-1marlgjv7f-ai-v3:600:400:600:400:q70.jpg,2026-07-21 18:01:03
tmtpost_news|8074152,tmtpost_news,https://www.tmtpost.com/8074152.html,让“神笔马良”成真，这家 AI 公司估值过百亿,把成本压到一千分之一。,https://images.tmtpost.com/uploads/images/2026/07/20260721175201385.png,2026-07-21 17:55:09
techcrunch_news|3144590,techcrunch_news,https://techcrunch.com/2026/07/21/music-streamer-deezer-says-more-than-50-of-daily-uploads-are-ai-generated,Music streamer Deezer says more than 50% of daily uploads are AI-generated,"Deezer said more than 90,000 AI-generated tracks were uploaded daily on the platform in June",,2026-07-21 14:27:42
techcrunch_news|3144417,techcrunch_news,https://techcrunch.com/2026/07/21/gritt-exits-stealth-with-34-million-for-robots-to-build-solar-plants-then-everything-else,"Gritt exits stealth with $32 million for robots to build solar plants — then, everything else",Gritt is coming out of stealth with $34 million and plans to automate the hardest tasks on construction sites.,https://techcrunch.com/wp-content/uploads/2026/07/gritt-machine-3.jpg,2026-07-21 11:00:00
ifanr_news|1672648,ifanr_news,https://www.ifanr.com/1672648,1500 元的 Codex 键盘卖断货，这小哥反手自己造了一台,一起缺货的还有 ChatGPT 篮球,https://s3.ifanr.com/wp-content/uploads/2026/07/cover5.png,2026-07-21 09:52:49
verge_news|dmcyOnBvc3Q6OTY4Mzc1,verge_news,https://www.theverge.com/tech/968375/sony-udio-lawsuit-songs-ai-copyright,"Here are the 30,000 songs Sony is suing Udio’s AI music generator over","Songs from Beyoncé, Britney Spears, Johnny Cash, Harry Styles, and many more are on the list.","https://platform.theverge.com/wp-content/uploads/sites/2/2025/02/STK467_AI_MUSIC_CVirginia_A.jpg?quality=90&strip=all&crop=0,0,100,100",2026-07-21 06:19:12
verge_news|dmcyOnBvc3Q6OTY4MjU3,verge_news,https://www.theverge.com/business/968257/spacex-in-your-index-fund-explained,"SpaceX in your index fund, explained",Index funds are supposed to be the safest way to invest — does SpaceX change that?,"https://platform.theverge.com/wp-content/uploads/sites/2/2026/06/STKE012_SPACEX_IPO_2026_D.jpg?quality=90&strip=all&crop=0,0,100,100",2026-07-21 05:00:00
mtr_news|https://www.technologyreview.com/2026/07/21/1140602/advancing-next-gen-ai-with-materials-science-innovation/,mtr_news,https://www.technologyreview.com/2026/07/21/1140602/advancing-next-gen-ai-with-materials-science-innovation,Advancing next-gen AI with materials science innovation,"As artificial intelligence pushes semiconductors and data centers to new physical limits, advances in materials science are becoming essential to sustaining the pace of innovation.",https://wp.technologyreview.com/wp-content/uploads/2026/07/Syensqo-shutterstock_2491787317.jpg,2026-07-21 00:00:00
wired_news|https://www.wired.com/story/big-interview-stanford-students-booing-sundar-pichai/,wired_news,https://www.wired.com/story/big-interview-stanford-students-booing-sundar-pichai,‘It’s a Modern-Day Draft’: Why Stanford Students Walked Out on Sundar Pichai’s Commencement Speech,,"https://media.wired.com/photos/6a5e768ffe9236587e2acd7d/16:9/w_1600,c_limit/Big-Interview-UV-Stanford-Students-Business.jpg",
