id,source,url,headline,abstract,img_url,publish_time
github_trending|TapXWorld/ChinaTextbook,github_trending,https://github.com/TapXWorld/ChinaTextbook,TapXWorld/ChinaTextbook,所有小初高、大学PDF教材。项目的由来 虽然国内教育网站已提供免费资源，但大多数普通人获取信息的途径依然受限。有些人利用这一点，在某站上销售这些带有私人水印的资源。为了应对这种情况，我计划将这些资源集中并开源，以促进义务教育的普及和消除地区间的教育贫困。 还有一个最重要的原因是，希望海外华人能够让自己的孩子继续了解国内教育。 学习数学 希望未来出现更多不是为了考学而读书的人。 小学数学 一年级上册 一年级下册 二年级上册 二年级下册 三年级上册 三年级下册 四年级上册 四年级下册 五年级上册 五年级下册 六年级上册 六年级下册 初中数学 初一上册 初一下册 初二上册 初二下册 初三上册 初三下册 高中数学 目录 大学数学 高等数学 线性代数 离散数学 概率论 更多数学资料-(大学数学网) 问题：如何合并被拆分的文件？ 由于 GitHub 对单个文件的上传有最大限制，超过 100MB 的文件会被拒绝上传，超过 50MB 的文件上传时会收到警告。因此，文件大小超过 50MB 的文件会被拆分成每个 35MB 的多个文件。 示例 文件被拆分的示例： 义务教育教科书 · 数学一年级上册.pdf.1 义务教育教科书 · 数学一年级上册.pdf.2 解决办法 要合并这些被拆分的文件，您只需执行以下步骤(其他操作系统同理)： 将合并程序 mergePDFs-windows-amd64.exe 下载到包含 PDF 文件的文件夹中。 确保 mergePDFs-windows-amd64.exe 和被拆分的 PDF 文件在同一目录下。 双击 mergePDFs-windows-amd64.exe 程序即可自动完成文件合并。 下载方式 您可以通过以下链接，下载文件合并程序： 下载文件合并程序 文件和程序示例 mergePDFs-windows-amd64.exe 义务教育教科书 · 数学一年级上册.pdf.1 义务教育教科书 · 数学一年级上册.pdf.2 重新下载 如果您位于内地，并且网络不错，想重新下载，您可以使用 tchMaterial-parser 项目（鼓励开源），进行重新下载。 如果您位于国外，和内地网络通信速度较慢，建议使用本存储库进行签出。 教材捐献 如果这个项目帮助您免费获取教育资源，请考虑支持我们推广开放教育的努力！您的捐献将帮助我们维护和扩展这个资源库。 加入我们的 Telegram 社区，获取最新动态并分享您的想法：https://t.me/+1V6WjEq8WEM4MDM1 Star History 支持我 如果您觉得这个项目对您有帮助，您可以扫描以下二维码进行捐赠：,https://opengraph.githubassets.com/d49e41f8dbffba2914e01cfe7a8abf5fd74ad15bdf85fac6ab7d260f8db45a61/TapXWorld/ChinaTextbook,2026-06-08 09:44:56
github_trending|RyanCodrai/turbovec,github_trending,https://github.com/RyanCodrai/turbovec,RyanCodrai/turbovec,"A vector index built on TurboQuant, written in Rust with Python bindings A 10 million document corpus takes 31 GB of RAM as float32. turbovec fits it in 4 GB - and searches it faster than FAISS. turbovec is a Rust vector index with Python bindings, built on Google Research's TurboQuant algorithm — a data-oblivious quantizer that matches the Shannon lower bound on distortion, with no codebook training and no separate train phase. Online ingest. Add vectors, they're indexed — no train step, no parameter tuning, no rebuilds as the corpus grows. Faster than FAISS. Hand-written NEON (ARM) and AVX-512BW (x86) kernels beat FAISS IndexPQFastScan by 12–20% on ARM and match-or-beat it on x86. Filter at search time. Pass an id allowlist (or a slot bitmask) to search() and the kernel honours it directly. You always get up to k results from the allowed set — no over-fetching, no recall hit on selective filters. Pure local. No managed service, no data leaving your machine or VPC. Pair with any open-source embedding model for a fully air-gapped RAG stack. Building RAG where privacy, memory, or latency matters? You're in the right place. Python pip install turbovec from turbovec import TurboQuantIndex index...",https://repository-images.githubusercontent.com/1192555574/c9d82d4e-1a88-4201-a548-615cfbb0b16a,2026-06-08 09:44:56
kr36_news|3841042041211145,kr36_news,https://36kr.com/p/3841042041211145,AI还能让PC组装商吃多久红利？,AI还能让PC组装商吃多久红利？,https://img.36krcdn.com/hsossms/20260608/v2_6b6010d0ad70404abf2ce003846117b0@5091053@ai_oswg1014615oswg1053oswg495_img_png~tplv-1marlgjv7f-ai-v3:600:400:600:400:q70.jpg,2026-06-08 09:41:47
tmtpost_news|8018307,tmtpost_news,https://www.tmtpost.com/8018307.html,豆包想赚钱，要先Codex化,赚钱不寒碜,https://images.tmtpost.com/uploads/images/2026/06/baad86293a9e696aa029545dc3c5ba1b_1780882156.png,2026-06-08 09:33:14
wscn_news|3773962,wscn_news,https://wallstreetcn.com/member/articles/3773962,物理AI离我们还有多远？,黄仁勋在电脑展上新推出的生态系统套件，标志着人工智能产业正迎来其发展的第二阶段：涌向物理AI 。,https://wpimg-wscn.awtmt.com/512ba0b3-273b-426c-98cf-f7a4993b16fa.png,2026-06-08 09:13:58
kr36_news|3843116494473478,kr36_news,https://36kr.com/p/3843116494473478,环球和华纳被起诉：AI时代，版权方先“内讧”了,AI版权战争，出现了一个意想不到的新战场。这一次，被告不是AI公司，而是唱片公司。,https://img.36krcdn.com/hsossms/20260608/v2_7a697187bbf14cdba32f491041a26bdd@5091053@ai_oswg1028731oswg1053oswg495_img_png~tplv-1marlgjv7f-ai-v3:600:400:600:400:q70.jpg,2026-06-08 09:06:57
x_tweets|2063788531458146797,x_tweets,https://x.com/danshipper/status/2063788531458146797,"RT @justinobney: ""Bring your agents to the app"" is going to be such a vibe... I always want to see my schedule on these calendar pickers,…",,,2026-06-08 09:01:43
kr36_news|3842886530533633,kr36_news,https://36kr.com/p/3842886530533633,Claude Code之父：「品味」不是人类护城河；当工程师不再写代码，招聘看什么？,最终我们要教模型的，和我们教孩子的是同一件事。,https://img.36krcdn.com/hsossms/20260608/v2_a80d22c555fc4073987ba02d50d95491@5091053@ai_oswg1047816oswg1053oswg495_img_png~tplv-1marlgjv7f-ai-v3:600:400:600:400:q70.jpg,2026-06-08 09:00:29
kr36_news|3842898529975171,kr36_news,https://36kr.com/p/3842898529975171,录音硬件爆发，四大类产品争夺AI新入口，Agent能力成标配,AI功能趋同，要靠硬件能力分高下。,https://img.36krcdn.com/hsossms/20260608/v2_fdedb09c67584fa8afe00539946bbacb@5091053@ai_oswg1017948oswg1053oswg495_img_png~tplv-1marlgjv7f-ai-v3:600:400:600:400:q70.jpg,2026-06-08 09:00:11
kr36_news|3843652334946819,kr36_news,https://36kr.com/p/3843652334946819,AI 不会合作？那是因为他们没见过市场经济,如果你想让不会合作的 AI 学会合作，不要给它们写剧本，给它们一个市场。,"https://img.36krcdn.com/hsossms/20260608/v2_986180a15a7a4ed08045fedf5f35f1bf@000000_oswg147383oswg1280oswg545_img_000?x-oss-process=image/resize,m_mfit,w_600,h_400,limit_0/crop,w_600,h_400,g_center",2026-06-08 08:57:48
tmtpost_news|8018464,tmtpost_news,https://www.tmtpost.com/8018464.html,大厂AI，激战高考,产品更好用了，但最关键的问题没解决。,https://images.tmtpost.com/uploads/images/2026/06/24d3628fcc8226999c930c9fe33f4a04_1780879758.png,2026-06-08 08:56:33
kr36_news|3843660936301057,kr36_news,https://36kr.com/p/3843660936301057,宇树对手，要IPO了,2026年将成为具身智能公司集体上市的“大年”。,https://img.36krcdn.com/hsossms/20260608/v2_bbc9693beb3c4707bd025242d4571a8e@5091053@ai_oswg1068258oswg1053oswg495_img_png~tplv-1marlgjv7f-ai-v3:600:400:600:400:q70.jpg,2026-06-08 08:52:37
x_tweets|2063786182140735829,x_tweets,https://x.com/garrytan/status/2063786182140735829,This is why we created https://t.co/NH6AWPWWkY,,,2026-06-08 08:52:23
x_tweets|2063786111588323780,x_tweets,https://x.com/garrytan/status/2063786111588323780,Educating people on how to use the AI tools has become a serious bottleneck,,,2026-06-08 08:52:06
kr36_news|3843731063245062,kr36_news,https://36kr.com/p/3843731063245062,奥特曼欲交投名状，白宫计划入股OpenAI,当年轻人还在担心「毕业即失业」时，AI巨头们已经开始用「全民共享」来平息即将到来的风暴。,https://img.36krcdn.com/hsossms/20260608/v2_a08a1aca7e614c9fa15d8d63d4c93aa5@5091053@ai_oswg997208oswg1053oswg495_img_png~tplv-1marlgjv7f-ai-v3:600:400:600:400:q70.jpg,2026-06-08 08:52:00
x_tweets|2063786054193426533,x_tweets,https://x.com/garrytan/status/2063786054193426533,RT @paulg: This aged unfortunately well.,,,2026-06-08 08:51:53
kr36_news|3843807608801797,kr36_news,https://36kr.com/p/3843807608801797,“Token经济”进入结果层,中国市场的机会：从工具入口到流程交付,https://img.36krcdn.com/hsossms/20260608/v2_537192389b914cd7a75bb62dfa3463ef@5091053@ai_oswg1018248oswg1053oswg495_img_png~tplv-1marlgjv7f-ai-v3:600:400:600:400:q70.jpg,2026-06-08 08:51:24
x_tweets|2063785928242704686,x_tweets,https://x.com/garrytan/status/2063785928242704686,"RT @daniel_w_owens: I don’t want to psychoanalyze too much, but if you believe that SF is the “most far-right” city in the US, then I’m gen…",,,2026-06-08 08:51:23
kr36_news|3843652644718857,kr36_news,https://36kr.com/p/3843652644718857,ChatGPT将迎来史上最大改版，“AI只用来聊天的时代结束了”,ChatGPT的角色正在被重新定义：它正从一个聊天工具，逐步变成一个巨大的流量入口。真正承载估值和付费想象力的，是藏在它背后的编程工具和企业级服务。,https://img.36krcdn.com/hsossms/20260608/v2_7b50379ab8fd48858ef1b652cebe4174@5091053@ai_oswg1076757oswg1053oswg495_img_png~tplv-1marlgjv7f-ai-v3:600:400:600:400:q70.jpg,2026-06-08 08:49:24
x_tweets|2063785286367392095,x_tweets,https://x.com/garrytan/status/2063785286367392095,GBrain v0.42.30 can now give you a detailed summary of how your thinking has changed over time. https://t.co/lcj64PThft,,https://pbs.twimg.com/media/HKQJx-Ub0AAjZ6w.jpg,2026-06-08 08:48:50
x_tweets|2063782236068151305,x_tweets,https://x.com/garrytan/status/2063782236068151305,Centrist common sense local politics is the only way you can have a city that works We have to keep it this way,,,2026-06-08 08:36:42
x_tweets|2063782068195336639,x_tweets,https://x.com/garrytan/status/2063782068195336639,RT @paulg: Ideally you want to be dismissed as being on the right by people on the far left and dismissed as being on the left by people on…,,,2026-06-08 08:36:02
x_tweets|2063782001518489675,x_tweets,https://x.com/garrytan/status/2063782001518489675,"Don’t build Foxconn factories that make agents do the same thing over and over Agents by and large are smart, thoughtful, and not dangerous, so you should let them do more, not less",,,2026-06-08 08:35:47
x_tweets|2063781015970292067,x_tweets,https://x.com/steipete/status/2063781015970292067,"RT @thsottiaux: I have a new kind of big button that I can press for Codex. Over the next 100 days, we will select one person per day who d…",,,2026-06-08 08:31:52
wscn_news|3774050,wscn_news,https://wallstreetcn.com/articles/3774050,陈果：重估中国碳基龙头,陈果认为，全球硅基经济剧烈震荡之际，A股风格再平衡如期而至。机构普遍看空碳基、追捧硅基，但这或许是一个重大的认知偏差——中国PMI企稳、一线地产触底回升、PPI加速修复、政策持续加码内需。五大信号指向同一结论：美式“硅基替代碳基”并不适用中国国情，碳基龙头重估窗口或已开启。,https://wpimg-wscn.awtmt.com/19ad64a8-5b93-4634-bfa4-0b3f24e617b6.png,2026-06-08 08:16:37
wscn_news|3774048,wscn_news,https://wallstreetcn.com/articles/3774048,英伟达与海力士官宣多年合作计划，锁定先进存储供应，黄仁勋称“协议期限将超两年且有能力持续续约”,"英伟达与SK海力士官宣多年期战略合作——联合研发覆盖AI超算、个人PC到机器人全栈平台的下一代存储芯片，并锁定长期供应保障。英伟达CEO黄仁勋表示“与SK海力士的协议期限将超过两年并且有能力持续续约”，并警告存储短缺""将持续数年""。此次官宣恰在费城半导体指数单日暴跌逾10%、SK海力士盘前再跌逾10%的至暗时刻落地，能否力挽颓势，市场屏息以待。",https://wpimg-wscn.awtmt.com/f05ca355-77f0-47d8-a8e3-b25395e8d4e3.jpeg,2026-06-08 08:09:50
tmtpost_news|8018426,tmtpost_news,https://www.tmtpost.com/8018426.html,Edge AI Daily 早报（6月8日）,DeepMind CEO Demis Hassabis警示AGI或于2030年到来，呼吁社会紧急应对奇点级变革。NVIDIA确认Vera Rubin芯片量产，HBM4内存成本激增435%引发供应链风险。OpenAI计划将ChatGPT升级为整合编程工具与智能体的超级应用，瞄准企业市场冲刺上市。,https://images.tmtpost.com/uploads/images/2026/04/20260413171403305.png,2026-06-08 08:09:01
x_tweets|2063773025196192188,x_tweets,https://x.com/petergyang/status/2063773025196192188,Links I mentioned: Compound Engineering: https://t.co/zo3cxxgMeD Kun Chen's free tools: https://t.co/aqEdDzZKPe,,,2026-06-08 08:00:06
x_tweets|2063773012000952459,x_tweets,https://x.com/petergyang/status/2063773012000952459,"I’m trying to become a better AI builder and have been lucky enough to interview 5 of the best: 1. @kieranklaassen built the Compound Engineering system that many AI builders swear by. In our episode, he walked through exactly how it works, from planning to skills to commands like /ce-plan, /ce-work, and /lfg (let’s effing go). https://t.co/2xtZck8iX0 I’ll link the free Compound Engineering system below. 2. @ryancarson has started multiple companies and is now running a startup solo with OpenClaw, Codex, and Devin. It was fascinating to see the system he built to help him run his company. https://t.co/c3MYrstVnl 3. @Shpigford has been building products for 25 years. Like many AI builders, he created his own skill stack to streamline the way he works, including /build, /adversarial-code-review, /but-for-real, and /learnings. https://t.co/1ROWBF0tSk 4. @kunchenguid made it to L8 in big tech as a principal engineer, which is very hard. Then he quit to ship 40 PRs a day with agents and build free open source tools for visual planning, parallel agents, and AI code review. https://t.co/ELBGuGqHyr I’ll link his GitHub below too. 5. @mvanhorn has built some of the most popular open source AI projects on GitHub despite having no formal engineering background, including /last30days and his Printing Press system. I’m dropping his episode next week on my YouTube. If you’re trying to become a better AI builder too, start with these interviews that show you how real AI builders work. Subscribe for more conversations like this: https://t.co/1C6pbWzPYn",,https://pbs.twimg.com/media/HKP-ndHbUAA_1FN.jpg,2026-06-08 08:00:03
x_tweets|2063770300064383175,x_tweets,https://x.com/sama/status/2063770300064383175,RT @JucheAffirmer: American blacks shooting each other over twenty dollar debts are much closer to iron age Scandinavia than contemporary S…,,,2026-06-08 07:49:17
x_tweets|2063765921781424256,x_tweets,https://x.com/sama/status/2063765921781424256,RT @liminallogs: It's wild how they launder effects of the systematic exploitation of workers and manipulation of financial and economic po…,,,2026-06-08 07:31:53
x_tweets|2063763970490532254,x_tweets,https://x.com/sama/status/2063763970490532254,RT @fentanylbrownie: I just think it’s funny that nobody has watched to the end of this video where they lay out that the old guy is an uns…,,,2026-06-08 07:24:08
x_tweets|2063763268842172791,x_tweets,https://x.com/sama/status/2063763268842172791,RT @DannyVegito: you can tell Mormonism is an American invention by how much of their culture is about exploiting loopholes to get away wit…,,,2026-06-08 07:21:20
x_tweets|2063763222117687580,x_tweets,https://x.com/sama/status/2063763222117687580,RT @SakrajdaS: @Y40IFRQTTING Rightoids think all classics are a morality tale for children and get really angry when anyone implies they ar…,,,2026-06-08 07:21:09
x_tweets|2063763211313119274,x_tweets,https://x.com/sama/status/2063763211313119274,RT @Y40IFRQTTING: That's because to be right wing you need to not understand any of these things. They must remain mysterious and intimidat…,,,2026-06-08 07:21:07
x_tweets|2063761891617607683,x_tweets,https://x.com/petergyang/status/2063761891617607683,RT @kunchenguid: i just had the pleasure of going on @petergyang's latest podcast episode and sharing how i use agents productively we tou…,,,2026-06-08 07:15:52
x_tweets|2063758407534870591,x_tweets,https://x.com/sama/status/2063758407534870591,"RT @CollapseAnime: It won't be some kind of situation where there's a culture shift or anything. It's literally going to be ""we don't have…",,,2026-06-08 07:02:01
x_tweets|2063756386572681606,x_tweets,https://x.com/levie/status/2063756386572681606,"This is what the market got wrong about AI eating enterprise software. Building good software in the past was very hard. Yes, AI has made that a bit easier, though it’s still hard to build something that’s got good taste, differentiated, high quality, secure, and so on. But nevertheless, that’s only one component of building a platform that enterprises rely on. The plurality of costs in most enterprise software companies is actually on GTM, because at scale most enterprise software categories are tough to break into and need a heavy amount of consultative selling and support for implementation and integration of solutions. AI hasn’t reduced the need for that, and in many cases requires it even more now, as landscapes get even more busy and complicated for buyers to navigate through. If you make one thing cheaper and more abundant (development of software) then the new problem of discoverability and market differentiation (GTM) becomes the hardest part.",,,2026-06-08 06:53:59
x_tweets|2063755314512420899,x_tweets,https://x.com/sama/status/2063755314512420899,the 5% of malignant people ruining the US are all professional class yuppies,,,2026-06-08 06:49:44
x_tweets|2063754871392666001,x_tweets,https://x.com/sama/status/2063754871392666001,The crowdsourced panopticon only works as long as peple believe in it enough to actively assist it. There's a reason that EVERY example of it gets boosted by MSM/paid social media influencers to keep it going.,,,2026-06-08 06:47:58
x_tweets|2063744208587125142,x_tweets,https://x.com/amasad/status/2063744208587125142,Replit is about removing all distractions and have you focus on what matters — getting to market and getting the bag. Congrats!,,,2026-06-08 06:05:36
x_tweets|2063739350802735448,x_tweets,https://x.com/danshipper/status/2063739350802735448,RT @every: Weekends at the Every office https://t.co/2wkiYYqYKG,,https://pbs.twimg.com/media/HKPfvxBbQAAZOaX.jpg,2026-06-08 05:46:18
x_tweets|2063731771284619521,x_tweets,https://x.com/adityaag/status/2063731771284619521,"I have had the chance to go through two IPOs (Meta and Dropbox). Fabulous wealth tends to amplify deeper desires, not create new ones. The mainstream narrative is: ""Early Employees make lots of money and buy mansions and go to the beach"". For some: Yes, they want to chill. That is great. I am happy for them. But for a lot of folks, it is a chance to do even crazier and wackier stuff. Start new things. Fund new things. Keep the crazy loop of Silicon Valley going. It's going to be awesome to have a lot of folks with liquidity in the coming months. Onwards!.",,,2026-06-08 05:16:11
ifanr_news|1668337,ifanr_news,https://www.ifanr.com/1668337,对话 MiniMax 择因：Agent 终会超过人类，我们又将何去何从？,山雨欲来,https://s3.ifanr.com/wp-content/uploads/2026/06/img_6a264e6d02b5e.png,2026-06-08 05:15:28
x_tweets|2063714700618334260,x_tweets,https://x.com/rauchg/status/2063714700618334260,"Vercel AI Gateway recovers on average over 1T tokens a month 🤯 Much like Stripe recovers revenue with smart retries on failed payments or credit card updates. And we do it with 0️⃣ zero markup over the labs; adding redundancy, zero-data retention enforcement, observability, usage APIs, caps, … https://t.co/OougSipbBX",,,2026-06-08 04:08:21
ifanr_news|1668041,ifanr_news,https://www.ifanr.com/1668041,英伟达：带领 PC，重铸 PC｜硬哲学,将人类从人类中解放出来,https://s3.ifanr.com/wp-content/uploads/2026/06/jensen-16t9.jpg,2026-06-08 03:59:44
x_tweets|2063704354910347520,x_tweets,https://x.com/realmadhuguru/status/2063704354910347520,"A common misconception is that training data is low skill, grunt work - scan some notebooks, mine the internet, create labeled samples. The data required to advance the model frontier is the opposite. Labs need training data for high-economic-value tasks. And most of these tasks outside of SWE have little documentation - it is complex, domain-specific knowledge built over the years, spanning legacy tools that don’t talk to each other. That's why we have SWE agents and not knowledge work agents yet. The companies creating this training data, such as Mercor, are doing extremely high-leverage, high-skill work. Critical to moving AI forward. And deeply underappreciated.",,,2026-06-08 03:27:14
x_tweets|2063698736031649869,x_tweets,https://x.com/sama/status/2063698736031649869,"RT @Empty_America: On the other hand, the petit-bourgeoisie personality type (expressed today as the suburban employee) seems to be on the…",,,2026-06-08 03:04:54
x_tweets|2063697162748260627,x_tweets,https://x.com/steipete/status/2063697162748260627,Here’s your monthly reminder that you shouldn’t be prompting coding agents anymore. You should be designing loops that prompt your agents.,,,2026-06-08 02:58:39
x_tweets|2063695165915820084,x_tweets,https://x.com/amasad/status/2063695165915820084,"RT @etnshow: ""AGI for vibe-coding is coming earlier than 2028"" says Michele Catasta (@pirroh) President of Replit (@Replit): ""I would expe…",,,2026-06-08 02:50:43
x_tweets|2063693061805207885,x_tweets,https://x.com/sama/status/2063693061805207885,"RT @Audmund: IP law is the biggest form of slavery alive, not only has the plantation master stripped you of your land &amp; reproductive right…",,,2026-06-08 02:42:22
x_tweets|2063690106008145942,x_tweets,https://x.com/amasad/status/2063690106008145942,"RT @jasonlk: At SaaStr AI 2026, @amasad CEO @Replit and I did an incredible deep dive A top 0.1% power user + the CEO on stage together!…",,,2026-06-08 02:30:37
x_tweets|2063682464921604189,x_tweets,https://x.com/petergyang/status/2063682464921604189,"Most engineering processes were built for teams shipping 10 to 15 PRs a month. @kunchenguid, ex-Meta L8 engineer, is now shipping 40+ PRs a day with agents. That breaks a lot of existing processes behind: → Code review & QA → Merge gates and team handoffs When output jumps 10x, the old workflows starts to crack. The answer is to build systems that streamline planning, validation, review, and merging as much as possible. 📌 Watch him talk more about it here: https://t.co/UaoPKjbSC0",,https://pbs.twimg.com/amplify_video_thumb/2063682407598059520/img/ImkLKnrmiDTSElHx.jpg,2026-06-08 02:00:15
ifanr_news|1668272,ifanr_news,https://www.ifanr.com/1668272,早报｜苹果发布会限量礼品曝光/字节跳动：没有造车计划/谷歌每月花9.2亿美元向SpaceX租算力,· 本田在华销量连续两个月接近腰斩 · 京东与腾讯据称将围绕 AI Agent 合作 · 全球首个预制算力中心底座在青岛投用,https://s3.ifanr.com/images/ep/cover-images/cai_se_la_bi_cover.jpg,2026-06-08 00:40:29
x_tweets|2063649508681224367,x_tweets,https://x.com/levie/status/2063649508681224367,"Box now has a markdown editor on the web. Full CLI support. Commenting. Full version history. Box Drive also lets you connect to any desktop client as a mounted drive, so you instantly work with all your files in Claude Cowork, Codex, Obsidian, Cursor, or any other app. https://t.co/3dJ5SBzhM5",,https://pbs.twimg.com/amplify_video_thumb/2063649400552034304/img/9JtcpSdgnwtmUO0c.jpg,2026-06-07 23:49:18
x_tweets|2063638307586662539,x_tweets,https://x.com/zarazhangrui/status/2063638307586662539,"I think one reason that my Frontend Slides skill has grown so much organically is because slides are inherently social People see these cool slides and always ask ""how did you make it"". And people tend to perceive those using HTML decks as more AI-native and AI-savvy https://t.co/CiQpfibZn5",,https://pbs.twimg.com/media/HKODTlAbUAAxJvI.jpg,2026-06-07 23:04:47
x_tweets|2063630238123483195,x_tweets,https://x.com/nikunj/status/2063630238123483195,"The vibe shift from tokenmaxxing and token anxiety to tokenoptimizing in just a few weeks is wild 😅 Might be a hot take but I still believe companies should give copious amounts of token budget to employees to stay at the frontier and explore all the edges. Otherwise, it’s way too easy to fall back to “doing the things how they have always been done”.",,,2026-06-07 22:32:43
techcrunch_news|3130284,techcrunch_news,https://techcrunch.com/2026/06/07/is-this-the-dawn-of-the-tokenpocalypse,Is this the dawn of the Tokenpocalypse?,We&#8217;re likely to see more price increases as the big AI companies plan to go public.,,2026-06-07 21:26:13
