id,source,url,headline,abstract,img_url,publish_time
x_tweets|2073147672106873001,x_tweets,https://x.com/_catwu/status/2073147672106873001,What are you building with Fable 5 this long weekend? Show me your demos in the replies!,,,2026-07-04 04:51:36
x_tweets|2073138135014502777,x_tweets,https://x.com/levie/status/2073138135014502777,"The battle in AI is shaping up to be a battle for context. Everything in AI is about making sure that agents are effective as possible. That effectiveness comes down to whether the agent has the right domain expertise, access to the right context and tools to work with, and are involved in workflow in a way that users can easily interact with, review its work, and incorporate it into the rest of the process. As a consequence, the platforms that are able to capture and leverage the best and most context within their agents —and be able to pick the right models for the task- will be the place where agents do their best work. You can just look at coding agents, legal agents, or support agents as examples of what this looks like at scale. This is why the applied AI layer has a lot more value than just being an LLM wrapper. The ability to organize the critical knowledge for the work being done, and maintain this knowledge in a governed way where only the right people and agents have access, and the ability to improve the context for agents more and more over time, is critical. Over time, this layer will be able to route work between a variety of models, leveraging frontier intelligence for planning and orchestration and review, and a mix of lower cost models (open or closed) for the large volume of work between these tasks. The applied layer is also in a good position to train and develop its own models as well that are purpose built for their domains. Never good to bet against the bitter lesson, but equally taking a near frontier base model and post training it for just one type of domain work can -in many cases- lower costs or deliver better performance for certain tasks. Finally, this applied layer is also where most of the change management of the workflow will need to occur. This is why FDEs are so important at the applied layer, because this is the point where the customer needs to have specific business problem solved by a particular vendor. Whichever companies can solve that completely in an end-to-end fashion will have the greatest moats. As each day goes on, we’re learning more about what the likely long term market dynamics will look like in AI.",,,2026-07-04 04:13:43
x_tweets|2073135455554650384,x_tweets,https://x.com/swyx/status/2073135455554650384,"RT @ConorBronsdon: .@aiDotEngineer World's Fair was one of the most unique, interesting conferences I've been to: - incredible conversatio…",,,2026-07-04 04:03:04
x_tweets|2073135384536760368,x_tweets,https://x.com/petergyang/status/2073135384536760368,@NousResearch @karan4d Update: We are now talking about Sonic Adventures 2 😅,,,2026-07-04 04:02:47
x_tweets|2073132174958841887,x_tweets,https://x.com/rauchg/status/2073132174958841887,"Agentic self-improvement. Give your agent the ability to introspect its past runs, spot inefficiencies, errors, redundant tool calls, and produce new prompts and skills. That’s why agent observability is built-in when you deploy https://t.co/99eEa13mZ3 to Vercel.",,,2026-07-04 03:50:02
x_tweets|2073127743131464059,x_tweets,https://x.com/steipete/status/2073127743131464059,Shoutout to @vhbrzezowski for is rad CodexBar website redesign! And to everyone who keeps sending me PRs to support now *checks note* 56 providers. You're the best! https://t.co/lJ4dxNI4pe Just shipped a slick new update that makes settings way nicer and more intuitive.,,,2026-07-04 03:32:25
x_tweets|2073127044708479429,x_tweets,https://x.com/rauchg/status/2073127044708479429,"“We hold these truths to be self-evident, that all men are created equal, that they are endowed by their Creator with certain unalienable Rights, that among these are Life, Liberty and the pursuit of Happiness.” Such beautiful, sacred words.",,,2026-07-04 03:29:38
x_tweets|2073120046466183614,x_tweets,https://x.com/petergyang/status/2073120046466183614,If folks have better ideas on how to do this btw I’m all ears https://t.co/9c5ZGd3LSu,,https://pbs.twimg.com/media/HMUzsesawAAiCHf.jpg,2026-07-04 03:01:50
x_tweets|2073119955709821372,x_tweets,https://x.com/rauchg/status/2073119955709821372,"I like my airplanes like I like my 𝚁𝚎𝚊𝚌𝚝.𝚌𝚛𝚎𝚊𝚝𝚎𝙴𝚕𝚎𝚖𝚎𝚗𝚝 syntax: JSX A glimmer of hope for how great airtravel could be again. Lightning quick onboarding, no security theater, Starlink, unstressed friendly staff, convenient terminals. https://t.co/D32Npuxvlg",,https://pbs.twimg.com/media/HMUznJtaEAA5RHx.jpg,2026-07-04 03:01:28
ifanr_news|1670819,ifanr_news,https://www.ifanr.com/1670819,史上最强的 MacBook 要来了，苹果要 All in AI,近 5 年 MacBook Pro 最大升级即将到来,https://s3.ifanr.com/wp-content/uploads/2026/07/cover-1024x576.jpeg,2026-07-04 02:43:11
x_tweets|2073115061355532429,x_tweets,https://x.com/petergyang/status/2073115061355532429,"Because Instagram and TikTok APIs are garbage, I have this crazy Codex workflow that makes video clips for me (ffmpeg ftw) and then uses browser use for Meta Business Suite and TikTok UI to schedule them. I'm always worried it'll fall over since there are like 20+ steps and UI button clicks but so far so good.",,,2026-07-04 02:42:01
x_tweets|2073111818223157427,x_tweets,https://x.com/garrytan/status/2073111818223157427,RT @gregpr07: Most powerful browser agent yet,,,2026-07-04 02:29:08
x_tweets|2073111583765700821,x_tweets,https://x.com/garrytan/status/2073111583765700821,"RT @Altimor: Pretty cool how he goes from $1B to $100M to $50M in one sentence without seeming to notice, 1984-style. Reminds me of the jok…",,,2026-07-04 02:28:12
x_tweets|2073111474130849907,x_tweets,https://x.com/garrytan/status/2073111474130849907,"RT @BrianAcity: The Democratic Socialists of America are increasingly a vehicle for hardcore Marxists. At the DSA’s 2025 convention, as t…",,,2026-07-04 02:27:46
x_tweets|2073111295025652094,x_tweets,https://x.com/garrytan/status/2073111295025652094,RT @StartupArchive_: Ryan Petersen on what Paul Graham told him when he stepped down as Flexport CEO Y Combinator founder Paul Graham was…,,,2026-07-04 02:27:03
x_tweets|2073106884819841270,x_tweets,https://x.com/rauchg/status/2073106884819841270,"This is so powerful. ▲ Sandbox can now run 𝚍𝚘𝚌𝚔𝚎𝚛 and 𝚏𝚞𝚜𝚎, unconstrained. MicroVMs are the gift that keeps on giving. Instant boots, unconstrained runtimes. Very happy we bet on it as the foundation for 🌊 Fluid compute. S3-backed filesystem for agents in 10LOC ↓",,,2026-07-04 02:09:32
wscn_news|3776175,wscn_news,https://wallstreetcn.com/articles/3776175,市场误判？报道：台积电CoPoS首代或不采用玻璃基板，且从未考虑使用玻璃中介层,"据报道，首代CoPoS产品很可能不采用玻璃基板。这与当前市场上广泛流传的""玻璃基板为CoPoS核心""的叙事，并引发大量炒作行为，存在根本性出入。同时台积电从未考虑过玻璃中介层。",https://wpimg-wscn.awtmt.com/e74c6d52-06a8-4967-806d-65ca757be7a1.png,2026-07-04 02:09:23
x_tweets|2073106575787688190,x_tweets,https://x.com/swyx/status/2073106575787688190,"RT @shloked: Some notes from @aiDotEngineer world fair: &gt; the energy was incredible. it's magical to have a large group of smart, hungry,…",,,2026-07-04 02:08:18
x_tweets|2073106555344724259,x_tweets,https://x.com/swyx/status/2073106555344724259,RT @BhosalePratim: Had a long and eventful week at @aiDotEngineer It’s time to go back to Paris and ship. Taking back some great convers…,,,2026-07-04 02:08:13
x_tweets|2073106318563713122,x_tweets,https://x.com/swyx/status/2073106318563713122,RT @thorwebdev: That's a wrap of @aiDotEngineer World's Fair 2026 🥳 Many times larger than in previous years and yet it still felt like an…,,,2026-07-04 02:07:17
x_tweets|2073104683636547909,x_tweets,https://x.com/garrytan/status/2073104683636547909,NIMBYs like performative feel good virtue signal actions instead of actually solving the real problem by building housing,,,2026-07-04 02:00:47
x_tweets|2073104083754586139,x_tweets,https://x.com/garrytan/status/2073104083754586139,"RT @sdianahu: something interesting is happening for big models, it is easy to generate candidate solutions for code but *verifying* that t…",,,2026-07-04 01:58:24
x_tweets|2073102595972116953,x_tweets,https://x.com/petergyang/status/2073102595972116953,If you ask me I can really pay attention to 3 threads max. Maybe skill issue,,,2026-07-04 01:52:29
x_tweets|2073101082428047681,x_tweets,https://x.com/trq212/status/2073101082428047681,"this is one of the posts that my AIE talk was based on s/o to @geoffreylitt for an incredible discussion at AIE that helped me refine some of this, including adding quizzes",,,2026-07-04 01:46:29
x_tweets|2073101079877943683,x_tweets,https://x.com/trq212/status/2073101079877943683,You can see examples of HTML artifacts for finding unknowns here: https://t.co/eNS8g7P94x,,,2026-07-04 01:46:28
x_tweets|2073101078145724589,x_tweets,https://x.com/trq212/status/2073101078145724589,"I’ve found the most important part of working with Fable is discovering my own unknowns so I can prompt it better, heres how I do that.",,,2026-07-04 01:46:28
x_tweets|2073100352921215386,x_tweets,https://x.com/trq212/status/2073100352921215386,https://t.co/hPiZr1kG7r,,,2026-07-04 01:43:35
x_tweets|2073099372137484306,x_tweets,https://x.com/mattturck/status/2073099372137484306,RT @ctnzr: Why are open technologies for AI so important? How and why is NVIDIA building Nemotron? What can we learn from China’s AI effor…,,,2026-07-04 01:39:41
x_tweets|2073097796941484486,x_tweets,https://x.com/danshipper/status/2073097796941484486,"This is wrong, it’s the same model But it does fall back to Opud 4.8 slightly more, so the benchmarks are measuring a mix of Fable and Opus Skill issue",,,2026-07-04 01:33:25
x_tweets|2073095448878100816,x_tweets,https://x.com/petergyang/status/2073095448878100816,How many Codex or Claude Code threads can you pay attention to at once? Be honest 👇,,,2026-07-04 01:24:05
x_tweets|2073094559735894351,x_tweets,https://x.com/garrytan/status/2073094559735894351,"RT @GJarrosson: The founder's journey: finding trust in a frothy market. The YC network offered unbiased advice and support, with many earl…",,,2026-07-04 01:20:33
x_tweets|2073094464806305811,x_tweets,https://x.com/garrytan/status/2073094464806305811,Fund recovery and treatment Defund harm acceleration,,,2026-07-04 01:20:11
x_tweets|2073094058684334409,x_tweets,https://x.com/garrytan/status/2073094058684334409,RT @SusanDReynolds: They’re paid agitators. It’s everywhere. https://t.co/RfIXNawSS5,,https://pbs.twimg.com/media/HMP4LTGaMAAaCNC.jpg,2026-07-04 01:18:34
x_tweets|2073093877616316552,x_tweets,https://x.com/garrytan/status/2073093877616316552,"RT @stevesi: Just like that, no longer a billionaires tax. https://t.co/xgA0vpnK6w",,https://pbs.twimg.com/media/HMTpCskX0AA_cMj.jpg,2026-07-04 01:17:51
x_tweets|2073093809391477240,x_tweets,https://x.com/danshipper/status/2073093809391477240,"RT @emollick: Fable: ""Last and First Men is out of copyright. I want you to make a movie that features a reading of it with appropriate mix…",,,2026-07-04 01:17:35
x_tweets|2073093766366515315,x_tweets,https://x.com/steipete/status/2073093766366515315,RT @SIGKITTEN: Better call Sol,,,2026-07-04 01:17:24
x_tweets|2073092699318886425,x_tweets,https://x.com/steipete/status/2073092699318886425,I now have a working Apple Watch Cellular and a bank account. https://t.co/vcybhzGHQa,,https://pbs.twimg.com/tweet_video_thumb/HMUa0kHbIAAwsC7.jpg,2026-07-04 01:13:10
ifanr_news|1670957,ifanr_news,https://www.ifanr.com/1670957,早报｜大疆影石专利战火烧回国内/阿里内部全面禁用Claude Code/茉莉奶白被判赔LV 1030万后，月薪4万招法务,· 曝腾讯 QClaw 负责人张舒昱离职，否认内部存在「赛马」机制 · 每周最高 200 美元，特斯拉开始控制员工 AI 算力成本 · 阿里整合三大 AI 智能体产品，92 年钉钉 CEO 陈宇森统领,https://s3.ifanr.com/images/ep/cover-images/yong_quan_piao_you_cover.jpg,2026-07-04 01:00:51
x_tweets|2073080449182892426,x_tweets,https://x.com/garrytan/status/2073080449182892426,"RT @bscholl: Now that we're actively building a turbine and a turbine factory, we've moved to video updates for our investors. Here is ou…",,,2026-07-04 00:24:29
x_tweets|2073079598049591652,x_tweets,https://x.com/garrytan/status/2073079598049591652,"RT @ycombinator: .@garrytan on why the future is already here, it's just not evenly distributed. ""If you're just willing to spend $100,000…",,,2026-07-04 00:21:06
x_tweets|2073078083079503963,x_tweets,https://x.com/petergyang/status/2073078083079503963,"And yes, China is building AI super apps too https://t.co/1i9UL1NKsx https://t.co/CtIiAawEm5",,https://pbs.twimg.com/media/HMUNh99aIAAyA8e.jpg,2026-07-04 00:15:05
x_tweets|2073078067329970381,x_tweets,https://x.com/petergyang/status/2073078067329970381,"The AI super app era is here 1. Anthropic and OpenAI want to transform all knowledge work. Both labs want to remake how white-collar work gets done with agents. What started with coding has expanded to design, finance, legal, science, and more. Knowledge workers are now adopting Codex three times faster than developers. 2. The race to build the best AI super app is on. Whoever wins will pull massive attention away from pre-AI knowledge-work tools. The main players are Codex, Claude, Cursor, and a few others. With browser and computer use, I can already get Codex to handle almost everything I want to do on my computer. 3. OpenAI is well positioned for the super app race. ChatGPT has 800M+ weekly active users, and Codex is arguably the best AI super app right now. OpenAI has a clear opportunity to merge ChatGPT and Codex into one app and push agents into the mainstream. 4. Anthropic leads enterprise, but its product suite feels fragmented. Long term, I don’t think it makes sense for Claude, Cowork, Claude Code, and Claude Design to exist as separate products. Working with Claude needs to feel more like working with a single capable coworker, imo. I’m excited about the potential of Claude Tag for team productivity. 📌 More in my recent essay: https://t.co/jj568Tx1NU",,https://pbs.twimg.com/media/HMUNhBdbgAAdkhh.jpg,2026-07-04 00:15:01
x_tweets|2073077325520838993,x_tweets,https://x.com/danshipper/status/2073077325520838993,Get our Fable 5 prompt lirbrary and head to the beach: https://t.co/fM6HHcdsEs,,,2026-07-04 00:12:04
x_tweets|2073076447992746379,x_tweets,https://x.com/danshipper/status/2073076447992746379,"A new personal iOS app working end to end: 5M tokens Your whole prod bug backlog cleared: 20M tokens Unnecessarily detailed responses to every single unread email, Slack, and text message: 30M tokens Fable working for you while you’re at the pool: Priceless https://t.co/nN5dmQDMR1",,https://pbs.twimg.com/media/HMUMCORWoAEBCyj.jpg,2026-07-04 00:08:35
x_tweets|2073074869471002760,x_tweets,https://x.com/swyx/status/2073074869471002760,RT @Gavriel_Cohen: Recorded an impromptu podcast episode with @swyx for @latentspacepod last month at @aiDotEngineer SG. Covered good grou…,,,2026-07-04 00:02:19
x_tweets|2073074805058990508,x_tweets,https://x.com/swyx/status/2073074805058990508,RT @mervenoyann: I've been going to tech conferences since eternity and I have to say @aiDotEngineer is something else every time I go I m…,,,2026-07-04 00:02:04
x_tweets|2073071980442792420,x_tweets,https://x.com/swyx/status/2073071980442792420,"RT @MikeBradleyAI: “Within the next 18 months, you will be able to host GLM 5.2 equivalent intelligence on an RTX 5090 GPU.” -Ahmad Osman,…",,,2026-07-03 23:50:50
x_tweets|2073071915296845988,x_tweets,https://x.com/swyx/status/2073071915296845988,"RT @mnair1: None of it was an accident. A team that gave up recharge week, and a partnership @GeoffBibby built with @swyx + the AI Engineer…",,,2026-07-03 23:50:35
x_tweets|2073071749911200157,x_tweets,https://x.com/rauchg/status/2073071749911200157,Just learned our next baby will receive a special “Freedom 250” social security card for being born in the second half of this 250th anniversary year. Such a cool keepsake 🥹 🇺🇸 🦅 https://t.co/TsdIO1gvVk,,https://pbs.twimg.com/media/HMUHxUOaUAAB2kE.jpg,2026-07-03 23:49:55
x_tweets|2073071325644816440,x_tweets,https://x.com/nikunj/status/2073071325644816440,"I think the labs secretly release models when there are long weekends coming up.. Opus 4.5 right before Thanksgiving. Fable 5 now right before July of 4th. Giving the masses time to tinker, play, have their minds blown and go deeper into their token anxiety 😅",,,2026-07-03 23:48:14
x_tweets|2073070255031615877,x_tweets,https://x.com/thenanyu/status/2073070255031615877,Love the observation: if your field doesn’t produce good training data it was probably full of crap to begin with,,,2026-07-03 23:43:59
x_tweets|2073066919200956793,x_tweets,https://x.com/thenanyu/status/2073066919200956793,The best scenario is a doctor who spends significant time on your case and is equipped with LLMs,,,2026-07-03 23:30:43
x_tweets|2073066566497804501,x_tweets,https://x.com/thenanyu/status/2073066566497804501,This is basically correct but the framing is wrong. It’s better for 99% of people because you get more than 15min of an overworked and distracted persons attention. It’s also available any time of day 7 days a week. No waiting weeks or months for those 15min,,,2026-07-03 23:29:19
x_tweets|2073062966639911251,x_tweets,https://x.com/mattturck/status/2073062966639911251,RT @ivanburazin: Nobody can define what a sandbox is because the goalpost keeps moving. The evolution of what agents need from a sandbox:…,,,2026-07-03 23:15:01
x_tweets|2073056436628734157,x_tweets,https://x.com/thenanyu/status/2073056436628734157,You see this in basketball when the defender slaps the ball out of the offensive players hand and it goes out of bounds. In the previous era that’s always ball to the offense but now we examine the last marginal touch. The false precision doesn’t make the game better,,,2026-07-03 22:49:04
x_tweets|2073056434351202602,x_tweets,https://x.com/thenanyu/status/2073056434351202602,The worst aspect of VAR is that it privileges the letter of the rules over the spirit of the rules. Winning on a technicality is the lamest form of winning. No one is cherry-picking here. Defender got beat.,,,2026-07-03 22:49:04
x_tweets|2073053799791710301,x_tweets,https://x.com/garrytan/status/2073053799791710301,Wait time for specialists is going up at a moment AI is about to change it all I have a feeling AI will bring the quality of care up 100x and not a moment too soon for patients everywhere,,,2026-07-03 22:38:36
x_tweets|2072356250998964673,x_tweets,https://x.com/swyx/status/2072356250998964673,so proud to host my friend @trq212 to give the world’s first Fable talk on Fable return day! find him with @simonw and @_catwu in Expo Stage 2 for an extra EXTRA special lunch session at 12.30 today!! https://t.co/gx1K3kaiS8,,https://pbs.twimg.com/media/HMJ9BshbMAAdfkA.jpg,2026-07-02 00:26:47
wired_news|https://www.wired.com/story/google-deepmind-unionization-talks-are-off-to-a-rocky-start/,wired_news,https://www.wired.com/story/google-deepmind-unionization-talks-are-off-to-a-rocky-start,Google DeepMind Unionization Talks Are Off to a Rocky Start,,"https://media.wired.com/photos/6a47cb0ef78eee0a42c7fd67/16:9/w_1600,c_limit/GettyImages-2273112054.jpg",
