id,source,url,headline,abstract,img_url,publish_time
verge_news|dmcyOnF1aWNrUG9zdDo5MzY4NDA=,verge_news,https://www.theverge.com/ai-artificial-intelligence/936840/the-ansel-adams-trust-says-is-had-nothing-to-do-with-ai-colorized-version-of-his-photo,The Ansel Adams trust says is had nothing to do with AI-colorized version of his photo.,,,2026-05-24 21:13:02
wscn_news|3773004,wscn_news,https://wallstreetcn.com/articles/3773004,什么情况下，本轮AI大行情会结束？,复盘A股2015年、2021年及纳斯达克1998年三轮行情的终结逻辑，申万宏源策略团队认为，大波段行情结束无非三种情形——增量资金正循环无以为继、产业趋势证伪、宏观环境恶化。而当前，三个条件无一触发。,https://wpimg-wscn.awtmt.com/cf888fee-53be-4893-b208-0009d6cac556.jpeg,2026-05-24 19:22:07
qbitai_news|423421,qbitai_news,https://www.qbitai.com/2026/05/423421.html,卷到今天，Agent的含金量还在提升丨AIGC2026圆桌论坛,大厂集体下场后，创业公司还有哪些机会？,https://www.qbitai.com/wp-content/uploads/2026/05/41b6412883654889d1e78359f87395c3.png,2026-05-24 18:50:44
wscn_news|3773000,wscn_news,https://wallstreetcn.com/articles/3773000,“白宫股神”推了“最火的存储”！特朗普公开大赞美光,"集会前，期权""巨鲸""先行。5月22日下午，多名交易员集中买入美光深度虚值（OTM）看涨期权，行权价覆盖750美元至1400美元。仅1:19:09这一秒内，就有四笔不同行权价的看涨期权同时成交，合计溢价超过730万美元。所有交易清一色是买入方向，主动扫货意图明显。",https://wpimg-wscn.awtmt.com/48d06137-3d69-40bf-bb14-36a8276c4495.png,2026-05-24 18:49:43
tmtpost_news|8000513,tmtpost_news,https://www.tmtpost.com/8000513.html,Mythos的面纱，成了Anthropic撬动万亿的杠杆,谷歌和白宫，都拜倒在一个未公开发布的大模型下。,https://images.tmtpost.com/uploads/images/2026/05/20260524175948227.png,2026-05-24 18:02:24
tmtpost_news|7999975,tmtpost_news,https://www.tmtpost.com/7999975.html,DeepSeek永久降价，但梁文锋并不想做「赛博菩萨」,逆势降价，DeepSeek拿到了反向定价权。,https://images.tmtpost.com/uploads/images/2026/05/20260524175713909.png,2026-05-24 18:01:13
verge_news|dmcyOnBvc3Q6OTM2MTc2,verge_news,https://www.theverge.com/tech/936176/google-ai-overviews-search-disregard,Google’s AI search is so broken it can ‘disregard’ what you’re looking for,"With certain terms, AI Overviews are drawing a blank.","https://platform.theverge.com/wp-content/uploads/sites/2/2026/05/Screenshot-2026-05-22-at-8.44.28AM.png?quality=90&strip=all&crop=0,3.0141843971631,100,93.971631205674",2026-05-23 04:39:54
