id,source,url,headline,abstract,img_url,publish_time
github_trending|flutter/flutter,github_trending,https://github.com/flutter/flutter,flutter/flutter,"Flutter makes it easy and fast to build beautiful apps for mobile and beyond Flutter is Google's SDK for crafting beautiful, fast user experiences for mobile, web, and desktop from a single codebase. Flutter works with existing code, is used by developers and organizations around the world, and is free and open source. Documentation Install Flutter Flutter documentation Development wiki Contributing to Flutter For release and other announcements, join the flutter-announce mailing list. Our documentation also tracks breaking changes across releases. Terms of service The Flutter tool may occasionally download resources from Google servers. By downloading or using the Flutter SDK, you agree to the Google Terms of Service: https://policies.google.com/terms For example, when installed from GitHub (as opposed to from a prepackaged archive), the Flutter tool will download the Dart SDK from Google servers immediately when first run, as it is used to execute the flutter tool itself. This will also occur when Flutter is upgraded (e.g. by running the flutter upgrade command). About Flutter We think Flutter will help you create beautiful, fast apps, with a productive, extensible and open development model, whether you're targeting iOS or Android, web, Windows, macOS, Linux or embedding it as the UI toolkit...",https://repository-images.githubusercontent.com/31792824/fb7e5700-6ccc-11e9-83fe-f602e1e1a9f1,2026-06-25 09:39:16
github_trending|andreknieriem/headunit-revived,github_trending,https://github.com/andreknieriem/headunit-revived,andreknieriem/headunit-revived,"Headunit App for displaying Android AutoHeadunit Revived Headunit Revived is an Android app that allows you to turn your Android tablet or phone into an Android Auto receiver. This project is a revived version of the original headunit project by the great Michael Reid. The original project can be found here: https://github.com/mikereidis/headunit Screenshots How to use Check out the Wiki for detailed documentation, setup guides and troubleshooting! Wired USB Connection Connect your Android device (phone) to the tablet running Headunit Revived via USB cable. Make sure that Android Auto is installed on your phone. Set your phone to Host-Mode if nescessary and select Android Auto Click the USB Button in Headunit Revived, find your phone and click the right button to allow connection Click on your phone in the list and wait for Android Auto to start Wireless Helper (Recommended) This is the most reliable way to connect wirelessly. It uses our companion app on your phone to trigger the connection. Download: Wireless Helper on Google Play Store Features: Minimal configuration, supports NSD, Wi-Fi Direct Auto-Connect, and Bluetooth Auto-Start. Setup: In Headunit Revived Settings: Set Wireless Mode to Helper Mode. Ensure both devices are in the same network (Hotspot or...",https://opengraph.githubassets.com/756a27a86f4b15ea19859c1745c806c9c251a78350b91fb7440fc40a677adf00/andreknieriem/headunit-revived,2026-06-25 09:39:16
wscn_news|3775266,wscn_news,https://wallstreetcn.com/member/articles/3775266,日本酸素官宣提价30%开启新一轮涨价潮，氦气正升格为半导体产业链“卡脖子”级别战略物资,日本巨头宣布全面调涨氦气产品售价30%，再次印证全球氦气紧缺背景下，氦气已进入卖方市场。,https://wpimg-wscn.awtmt.com/91c6b7f3-eec1-4ed7-a3fa-65b503f958b6.png,2026-06-25 09:31:59
x_tweets|2069956505580003458,x_tweets,https://x.com/petergyang/status/2069956505580003458,I'll be publishing the interview on my YouTube. Subscribe here to get it in a few weeks: https://t.co/MbOfeFUJbn,,,2026-06-25 09:31:03
x_tweets|2069956492900610435,x_tweets,https://x.com/petergyang/status/2069956492900610435,"Ok, I am interviewing the legend @trq212 on Friday. I'm planning to ask him to show me: → His Claude Code setup and how he uses /goal and /loop and dynamic workflows → How he does planning with HTML + artifacts → His best practices for Claude Tag What else should we cover? Let us know in the replies.",,,2026-06-25 09:31:00
wscn_news|3775461,wscn_news,https://wallstreetcn.com/articles/3775461,康宁推出玻璃光学互连技术，剑指CPO市场,康宁发布玻璃光学互连组件Glass Bridge，专为CPO和玻璃基板半导体封装架构设计。该组件通过玻璃内部波导，直接连接光子集成电路（PIC）与光纤，解决两者之间数十倍的尺寸失配问题，目标耦合损耗低于2dB。康宁已与Meta、英伟达、亚马逊等超大规模云厂商签署数十亿美元长期供货协议。,https://wpimg-wscn.awtmt.com/9644ff51-7ed3-496d-a75d-0b3c3a80763b.png,2026-06-25 09:30:53
x_tweets|2069955722830393755,x_tweets,https://x.com/sama/status/2069955722830393755,"RT @Garbagestyleman: Total bullshit, and this should be called out. Men hate ""weird"" dudes way more than women do.",,,2026-06-25 09:27:56
wscn_news|3775460,wscn_news,https://wallstreetcn.com/articles/3775460,铠侠年报里的“存储超级周期”：苹果订单暴增、原料库存激增，整条产业链都在抢先布局,大摩认为，铠侠年报印证存储“超级周期”正加速兑现：苹果订单同比暴增58%，显示大客户正抢先备货；铠侠原材料库存激增，以提前锁定DRAM供应，整条产业链正在为下一轮涨价提前备货；同时资本开支全面转向前端设备，备战需求高峰。,https://wpimg-wscn.awtmt.com/839c98fa-38f6-442a-9e97-3986f736975e.png,2026-06-25 09:27:53
tmtpost_news|8039596,tmtpost_news,https://www.tmtpost.com/8039596.html,连豆包都收费了，你的AI还有多少“免费的午餐”？,命运赠送的赛博礼物，早已暗中标记了算力的价格。,https://images.tmtpost.com/uploads/images/2026/06/20260625091859755.png,2026-06-25 09:19:12
x_tweets|2069952067091955991,x_tweets,https://x.com/swyx/status/2069952067091955991,"RT @LaudeInstitute: At @CAISconf last month, @andykonwinski sat down with researchers on the conference floor -- @matei_zaharia @istoica05…",,,2026-06-25 09:13:25
x_tweets|2069951925202903176,x_tweets,https://x.com/zarazhangrui/status/2069951925202903176,The best founders post on X,,,2026-06-25 09:12:51
tmtpost_news|8039875,tmtpost_news,https://www.tmtpost.com/8039875.html,火山引擎正在批量生产Opus4.6,68 块用 SOTA？,https://images.tmtpost.com/uploads/images/2026/06/20260625091132961.png,2026-06-25 09:12:04
tmtpost_news|8039646,tmtpost_news,https://www.tmtpost.com/8039646.html,万亿智谱，建立在2.67%流通盘上的资本幻觉,一场“稀缺性”杠杆撬动的资本狂欢。,https://images.tmtpost.com/uploads/images/2026/06/20260625091141943.png,2026-06-25 09:11:59
kr36_news|3867863731557385,kr36_news,https://36kr.com/p/3867863731557385,曾毓群选了这家机器人,给钱给订单。,https://img.36krcdn.com/hsossms/20260625/v2_870c72555b1e4d8696c9639af15d47ec@5091053@ai_oswg1163133oswg1053oswg495_img_png~tplv-1marlgjv7f-ai-v3:600:400:600:400:q70.jpg,2026-06-25 09:09:00
kr36_news|3867878468670465,kr36_news,https://36kr.com/p/3867878468670465,他给谷歌做出了最火CLI工具，结果被开了,七年老兵，2.8万星项目,https://img.36krcdn.com/hsossms/20260625/v2_91d2ef09fa8045d0a132a76e512679a4@5091053@ai_oswg1011676oswg1053oswg495_img_png~tplv-1marlgjv7f-ai-v3:600:400:600:400:q70.jpg,2026-06-25 09:07:44
x_tweets|2069950622430896221,x_tweets,https://x.com/sama/status/2069950622430896221,"RT @somewheresy: I know too many guys on here who are stuck in like a 2020 timeloop same as the Woke 1.0 people they criticize, overwhelmin…",,,2026-06-25 09:07:40
x_tweets|2069950539199054245,x_tweets,https://x.com/sama/status/2069950539199054245,RT @somewheresy: Moral panics are very low culture / low vibration coded. Like the type of people who used to not be here on the internet b…,,,2026-06-25 09:07:21
kr36_news|3866562600227847,kr36_news,https://36kr.com/p/3866562600227847,光源资本创始人&CEO、L2F光源创业者基金创始合伙人郑烜乐：拥抱技术爆炸的黎明，AI与未来科技时代的早期投资范式 | 36氪WAVES2026新浪潮,郑烜乐：AI时代早期投资范式与光源布局思考,"https://img.36krcdn.com/hsossms/20260624/v2_cddd01bbb9414be5b32fe6814048e7c8@6381723_oswg606571oswg1053oswg495_img_png?x-oss-process=image/resize,m_mfit,w_600,h_400,limit_0/crop,w_600,h_400,g_center",2026-06-25 09:00:00
x_tweets|2069945112084537419,x_tweets,https://x.com/petergyang/status/2069945112084537419,I told @samstphenson today that if I don't have @meetgranola on in a meeting I basically feel naked. Perhaps the best product market fit signal lol https://t.co/QDRQkhgd1O,,https://pbs.twimg.com/media/HLnsEPbagAAplyr.jpg,2026-06-25 08:45:47
qbitai_news|438204,qbitai_news,https://www.qbitai.com/2026/06/438204.html,豆包收费版第一天，我：充值…又得充值？我要再充值！,专业版上线，首开付费模式,https://www.qbitai.com/wp-content/uploads/2026/06/image.png,2026-06-25 08:32:50
tmtpost_news|8039970,tmtpost_news,https://www.tmtpost.com/8039970.html,Edge AI Daily 早报（6月25日）,英伟达与SpaceX发债450亿美元创纪录，债务市场成为AI基建第二战场；OpenAI与Broadcom联合发布Jalapeño推理芯片，9个月流片速度揭示AI实验室转向定制硬件研发趋势。Alphabet纳入道琼斯指数标志AI升格为美国经济新底座，而Meta成为唯一拒绝政府AI审查的前沿巨头，暴露开源基因与国家安全的结构性矛盾。,https://images.tmtpost.com/uploads/images/2026/04/20260413171403305.png,2026-06-25 08:25:24
x_tweets|2069939146265911525,x_tweets,https://x.com/petergyang/status/2069939146265911525,"Take one hour tonight to follow my Hermes tutorial below to install the app, set up your Telegram bot, enable voice, connect Google Workspace, and create a few routines. I made it super beginner friendly and walked through all the steps live in 45 min. You won't regret it. 📌 Watch here: https://t.co/RPAtyPKGQS",,https://pbs.twimg.com/media/HLnmnkAaEAAFpov.jpg,2026-06-25 08:22:04
kr36_news|3867757657003013,kr36_news,https://36kr.com/p/3867757657003013,华强北内存降价，AI不和我们抢内存了？,内存短期内是不会够用的,https://img.36krcdn.com/hsossms/20260625/v2_74d70539485a4751a49de9afd87e2a83@5091053@ai_oswg1027281oswg1053oswg495_img_png~tplv-1marlgjv7f-ai-v3:600:400:600:400:q70.jpg,2026-06-25 08:15:52
kr36_news|3867759884244229,kr36_news,https://36kr.com/p/3867759884244229,背刺老用户，MiniMax吞下苦果,市值只有智谱六分之一,https://img.36krcdn.com/hsossms/20260625/v2_315933a368294c9d93d2b1fd6f3c0d3b@5091053@ai_oswg991142oswg1053oswg495_img_png~tplv-1marlgjv7f-ai-v3:600:400:600:400:q70.jpg,2026-06-25 08:15:32
kr36_news|3867815574868996,kr36_news,https://36kr.com/p/3867815574868996,关于AI，黄仁勋最新发声,北京时间周四凌晨，全球市值最高上市公司英伟达举行年度股东大会。,https://img.36krcdn.com/hsossms/20260625/v2_91b4177b8dec4c548bbf978277f25770@5091053@ai_oswg1034748oswg1053oswg495_img_png~tplv-1marlgjv7f-ai-v3:600:400:600:400:q70.jpg,2026-06-25 08:14:31
x_tweets|2069937175899275475,x_tweets,https://x.com/swyx/status/2069937175899275475,we are going to have to Rebuild So. Much. Infra. for the age of Software Factories,,,2026-06-25 08:14:14
kr36_news|3867822758237444,kr36_news,https://36kr.com/p/3867822758237444,互联网商业模式之死,软件之后，大模型即将吞噬互联网,https://img.36krcdn.com/hsossms/20260625/v2_f443e594072b4fcd9fa1191dc8e10ecc@5091053@ai_oswg1050962oswg1053oswg495_img_png~tplv-1marlgjv7f-ai-v3:600:400:600:400:q70.jpg,2026-06-25 08:13:58
kr36_news|3867756936385537,kr36_news,https://36kr.com/p/3867756936385537,传可灵最新估值150亿美元，腾讯阿里红杉领投,继续上牌桌。,https://img.36krcdn.com/hsossms/20260625/v2_481f5266e31d4258af707b3c0e105742@5091053@ai_oswg1098207oswg1053oswg495_img_png~tplv-1marlgjv7f-ai-v3:600:400:600:400:q70.jpg,2026-06-25 08:08:48
kr36_news|3867748076655618,kr36_news,https://36kr.com/p/3867748076655618,OpenAI 发布首款芯片，只花了九个月,无法停止的飞轮,https://img.36krcdn.com/hsossms/20260625/v2_77a8ff861a5e4f30904cc71218f154ec@5091053@ai_oswg1071036oswg1053oswg495_img_png~tplv-1marlgjv7f-ai-v3:600:400:600:400:q70.jpg,2026-06-25 08:08:19
kr36_news|3867737936548872,kr36_news,https://36kr.com/p/3867737936548872,Claude写80%代码，Anthropic工程师却越来越孤独,Fiona Fung带领着被称为「全世界最AI化」的工程团队，用Claude Code把Anthropic人均代码量翻了8倍。可她发现，越用Claude Code，团队里的工程师越不跟人说话了。,https://img.36krcdn.com/hsossms/20260625/v2_61a39b8e79d14d428e0fd98e61dd3784@5091053@ai_oswg1050983oswg1053oswg495_img_png~tplv-1marlgjv7f-ai-v3:600:400:600:400:q70.jpg,2026-06-25 08:08:07
kr36_news|3867736555705603,kr36_news,https://36kr.com/p/3867736555705603,OpenAI曝出第一颗芯片叫「辣椒」，AI自己设计，9个月流片,OpenAI首颗自研芯片Jalapeño问世，9个月白纸到流片，创下行业最快纪录。设计它的，正是跑在上面的AI模型。,https://img.36krcdn.com/hsossms/20260625/v2_70a45ba7f320454caeeda7543b66667a@5091053@ai_oswg916073oswg1053oswg495_img_png~tplv-1marlgjv7f-ai-v3:600:400:600:400:q70.jpg,2026-06-25 08:07:48
x_tweets|2069935505135779987,x_tweets,https://x.com/sama/status/2069935505135779987,RT @petespiliakos: Donald Trump has zero American-born grandparents and his mother was an immigrant. I am open to the argument that Trump i…,,,2026-06-25 08:07:36
kr36_news|3867635704108297,kr36_news,https://36kr.com/p/3867635704108297,Open AI突然官宣，全量下放，剧烈战略转向后，GPT 5.5 Instant明日全民免费,Open AI掀桌子，同行集体慌了？,https://img.36krcdn.com/hsossms/20260625/v2_8d8324c03aa1412188d95fb4e76e45af@000000@ai_oswg309021oswg1536oswg722_img_000~tplv-1marlgjv7f-ai-v3:600:400:600:400:q70.jpg,2026-06-25 08:07:33
kr36_news|3867377228190980,kr36_news,https://36kr.com/p/3867377228190980,“中国版Mythos”：比得上吗，来得及吗？,智能体对所有事情进行了无差别的加速，包括网络攻击。,https://img.36krcdn.com/hsossms/20260625/v2_c3d6777ab79b4ac5a7eb9b0004fcff3c@5091053@ai_oswg1027872oswg1053oswg495_img_png~tplv-1marlgjv7f-ai-v3:600:400:600:400:q70.jpg,2026-06-25 08:07:12
kr36_news|3867242673018121,kr36_news,https://36kr.com/p/3867242673018121,复旦博士COSER牵头，蔡浩宇AI团队的最新研究给我整笑了,让AI过家家，很有必要。,https://img.36krcdn.com/hsossms/20260625/v2_96a072e16ed045e7a13771bc25baaf25@5091053@ai_oswg1128230oswg1053oswg495_img_png~tplv-1marlgjv7f-ai-v3:600:400:600:400:q70.jpg,2026-06-25 08:06:10
wscn_news|3775453,wscn_news,https://wallstreetcn.com/articles/3775453,财报炸裂！美光让空头闭嘴,美光科技用一份历史性财报狠狠回击了唱衰者：第三财季毛利率飙至84.9%，不仅创公司成立48年来历史新高，更将英伟达、Meta等科技巨头远远甩在身后。营收414.6亿美元、净利润282.4亿美元双双刷新纪录，盘后股价暴涨14%。更关键的是，美光已与超大型客户签署长期锁价协议，供应紧张或延续至2027年后。,https://wpimg-wscn.awtmt.com/06146944-2830-4fd3-8207-e91f3cc88b80.png,2026-06-25 08:04:20
x_tweets|2069934356899246083,x_tweets,https://x.com/garrytan/status/2069934356899246083,SF City Attorney David Chiu says sending a confidential legal brief to reporters is grounds for removal from public office. Jackie Fielder should resign.,,,2026-06-25 08:03:02
x_tweets|2069933987943084264,x_tweets,https://x.com/garrytan/status/2069933987943084264,RT @ArmandDoma: Just utterly depressing that the Democratic party is about to send someone to Congress who opposes interracial marriage for…,,,2026-06-25 08:01:34
kr36_news|3867203231520007,kr36_news,https://36kr.com/p/3867203231520007,孙正义的新万亿“赌局”,万亿赌局，孙正义的执念,https://img.36krcdn.com/hsossms/20260625/v2_b7f156b23e894f2f86000f77ca363afd@5091053@ai_oswg1099118oswg1053oswg495_img_png~tplv-1marlgjv7f-ai-v3:600:400:600:400:q70.jpg,2026-06-25 07:56:22
x_tweets|2069930473837429015,x_tweets,https://x.com/sama/status/2069930473837429015,"RT @Logo_Daedalus: You could summarize what JP Morgan does as ""dumping trash on the ground &amp; stealing public goods""",,,2026-06-25 07:47:37
x_tweets|2069925697741881633,x_tweets,https://x.com/nikunj/status/2069925697741881633,Excited to host a World Cup viewing party in SF next week with our friends at @Replit x @trincapital! Join us ⚽️🍾 https://t.co/lcxTnHzKap,,,2026-06-25 07:28:38
x_tweets|2069925173999083974,x_tweets,https://x.com/AmandaAskell/status/2069925173999083974,update 2: nooo,,,2026-06-25 07:26:33
qbitai_news|438179,qbitai_news,https://www.qbitai.com/2026/06/438179.html,世界模型混战，Momenta率先冲刺IPO,AI司机收入3年涨42倍,https://www.qbitai.com/wp-content/uploads/2026/06/47060c8ada3c2ed0357d82a139fbd607.jpeg,2026-06-25 07:20:28
wscn_news|3775451,wscn_news,https://wallstreetcn.com/articles/3775451,黄仁勋英伟达股东大会自夸：Blackwell“推理之王”、Vera CPU智能体专属、CUDA护城河,黄仁勋称，客户购买英伟达系统并非买计算工具，而是建设能直接创收的AI工厂；在基准测试中，Blackwell平台token吞吐量较次优平台高30倍；Vera Rubin是英伟达史上最重要发布产品之一；CUDA X库生态体系是英伟达的“皇冠珠宝”；美国批准H200芯片出口后，尚未在中国获相关收入。他罕见公开示警芯片走私，称走私芯片拼凑数据中心是“死路一条”。,https://wpimg-wscn.awtmt.com/5753a3f2-d4c9-4426-90b1-4d1c5e16a2f5.jpeg,2026-06-25 07:01:07
x_tweets|2069916038918250755,x_tweets,https://x.com/AmandaAskell/status/2069916038918250755,update: nooo,,,2026-06-25 06:50:15
x_tweets|2069910673921048985,x_tweets,https://x.com/AmandaAskell/status/2069910673921048985,"No more goals plz brazil, thank you.",,,2026-06-25 06:28:56
wscn_news|3775448,wscn_news,https://wallstreetcn.com/articles/3775448,手握千亿美元保底长单！美光电话会：内存已成AI时代战略资产，看不清供应何时才能赶上需求（附问答全文）,美光已与客户签下16份“包销”长单，锁定未来1000亿美元的最低保底收入，并提前落袋180亿美元现金押金。CEO表示，AI已将内存的地位提升为“战略资产”，受制于复杂的工艺升级与产能建设周期，全行业存储供应短缺的局面将持续至2027年以后。人形机器人单体内存需求达普通汽车10倍，或催生下一个数十年的超级周期。,https://wpimg-wscn.awtmt.com/ed02da56-2ed4-4ec3-92e0-f2ca85e19998.png,2026-06-25 06:27:43
x_tweets|2069908420384428132,x_tweets,https://x.com/zarazhangrui/status/2069908420384428132,The root cause of procrastination is not the lack of time It’s the lack of courage,,,2026-06-25 06:19:59
x_tweets|2069907688134443009,x_tweets,https://x.com/garrytan/status/2069907688134443009,RT @harjtaggar: Deploying voice agents in the enterprise needs the same testing discipline as self-driving cars. You can’t just put autonom…,,,2026-06-25 06:17:04
x_tweets|2069907629686808880,x_tweets,https://x.com/garrytan/status/2069907629686808880,RT @RecallFielder: Jackie Fielder spent 104 days in hiding after facilitating a crypto PUMP-and-DUMP scheme and committing municipal ESPION…,,,2026-06-25 06:16:50
x_tweets|2069907590193258914,x_tweets,https://x.com/garrytan/status/2069907590193258914,RT @harjtaggar: It’s remarkable how true this is. Investing can be frustrating for every investor when you don’t win a deal but the high qu…,,,2026-06-25 06:16:41
x_tweets|2069907527698108652,x_tweets,https://x.com/garrytan/status/2069907527698108652,RT @dflieb: Maybe you weren't meant to have a boss. https://t.co/ZKXX5Bn1em https://t.co/Hg2w60T5D4,,https://pbs.twimg.com/media/HLl980SaUAAYPLT.jpg,2026-06-25 06:16:26
x_tweets|2069907487600636392,x_tweets,https://x.com/garrytan/status/2069907487600636392,RT @vivianmshen: rounds MBB -&gt; YC founders raised in 2026 so far: &gt; announced today: @taktile_org $110M series C led by Goldman Sachs [McK…,,,2026-06-25 06:16:16
x_tweets|2069907467090489734,x_tweets,https://x.com/garrytan/status/2069907467090489734,"RT @dessaigne: I sat with a founder this week running a Series A company of 45 people, almost all engineers. A year ago that was right: by…",,,2026-06-25 06:16:11
verge_news|dmcyOnF1aWNrUG9zdDo5NTY1NDM=,verge_news,https://www.theverge.com/ai-artificial-intelligence/956543/nearly-400-local-newspapers-are-suing-openai-and-microsoft,Nearly 400 local newspapers are suing OpenAI and Microsoft.,,,2026-06-25 06:12:25
x_tweets|2069906038346961211,x_tweets,https://x.com/petergyang/status/2069906038346961211,I've known @berman66 for awhile and it's awesome to see him and the team build @runlayer to become the fastest onramp for enterprises to become AI native.,,,2026-06-25 06:10:31
x_tweets|2069900496304042343,x_tweets,https://x.com/zarazhangrui/status/2069900496304042343,"“Community is your users’ relationships with you and with each other, and most teams never think to design it Community is the new moat Features get copied. Belonging can’t” - from @figma Config session today",,,2026-06-25 05:48:29
x_tweets|2069899526916489660,x_tweets,https://x.com/garrytan/status/2069899526916489660,"RT @ExaAILabs: Introducing Exa Connect: connecting agents to data beyond the public web. Available today with ZoomInfo, Crunchbase, Simila…",,,2026-06-25 05:44:38
x_tweets|2069897318627946702,x_tweets,https://x.com/zarazhangrui/status/2069897318627946702,"My favorite session from @figma Config today was this talk by Chelsea Larson, the head of content design at Anthropic Here are my notes https://t.co/R1HzPnYc9r",,https://pbs.twimg.com/media/HLnAo8Wb0AAi_e9.jpg,2026-06-25 05:35:52
verge_news|dmcyOnF1aWNrUG9zdDo5NTY1MTI=,verge_news,https://www.theverge.com/ai-artificial-intelligence/956512/people-inc-ceo-says-its-probably-headed-for-a-confrontation-with-google-over-ai-crawling,People Inc. CEO says it’s “probably” headed for a confrontation with Google over AI crawling.,,,2026-06-25 05:06:41
x_tweets|2069889581412200848,x_tweets,https://x.com/zarazhangrui/status/2069889581412200848,The future of marketing will look more like eduction (esp for developer/builder marketing) People don’t wanna be marketed at They wanna learn,,,2026-06-25 05:05:07
verge_news|dmcyOnF1aWNrUG9zdDo5NTY0Njg=,verge_news,https://www.theverge.com/ai-artificial-intelligence/956468/this-week-in-the-big-ai-data-center-buildout,This week in the big AI data center buildout.,,,2026-06-25 04:52:44
x_tweets|2069879369472823622,x_tweets,https://x.com/sama/status/2069879369472823622,"RT @itsyaboidougie: At this point im wondering if this generation's widespread tech illiteracy was, in part, deliberately socially engineer…",,,2026-06-25 04:24:32
x_tweets|2069879222794121455,x_tweets,https://x.com/petergyang/status/2069879222794121455,"Declaring bankruptcy on my Codex threads, too many to archive manually https://t.co/gKMVy3UxKA",,https://pbs.twimg.com/media/HLmwKK6bAAAxDHZ.png,2026-06-25 04:23:57
x_tweets|2069876016445641142,x_tweets,https://x.com/mattturck/status/2069876016445641142,"RT @neilzegh: Shipping real-time translation, and new models coming soon. Our foundation model is not just STT and TTS, we’ll extend it to…",,,2026-06-25 04:11:13
wscn_news|3775440,wscn_news,https://wallstreetcn.com/articles/3775440,谷歌AI人才外流压力加剧：再失两名核心研究员转投Anthropic,继诺贝尔奖得主Jumper、Transformer架构发明者Shazeer出走后，Gemini核心开发者Adler与Pritzel也将转投Anthropic，两人正是当年与Jumper合作完成诺奖研究的核心成员。周一谷歌因Jumper离职跌超5%，今天消息公布后，股价一度跌超1%。,https://wpimg-wscn.awtmt.com/e50c44cf-e0b6-4379-98fb-e780a1e44763.jpeg,2026-06-25 03:35:37
x_tweets|2069864073202905501,x_tweets,https://x.com/swyx/status/2069864073202905501,"LOTS of alpha in this pod: - Why Databricks beat Snowflake (! a straight answer!) - Why everyone is building a metaharness now - Why the @neondatabase made so much sense (so much @nikitabase glazing its not even funny) - How LTAP solves the HTAP dream I discussed with @ankrgyl in our @braintrust pod - What happened to @MosaicML + DBRX - How to maintain research/startup culture in a $175B megacorp - What's more important knowledge/experience in the race to the agent cloud: databases, operating systems, or.... networking! very honored to be invited to @Data_AI_Summit to interview two of the top people in our industry and somehow be able to jam on everything from the @bennstancil modern data stack theme to @alighodsi's amazing keynote aura",,,2026-06-25 03:23:45
x_tweets|2069863762694459805,x_tweets,https://x.com/rauchg/status/2069863762694459805,Really fast GLM now live,,,2026-06-25 03:22:31
x_tweets|2069861190684045792,x_tweets,https://x.com/adityaag/status/2069861190684045792,The power of @southpkcommons is that you can get a chance to interact with some of the world's sharpest minds in a very intimate setting. https://t.co/xWaXyqC7Rj,,,2026-06-25 03:12:18
x_tweets|2069861187479618042,x_tweets,https://x.com/adityaag/status/2069861187479618042,It is a strange time to be a leader right now. You have to be fearless. You have to be optimistic. You have to be empathetic about upcoming changes. You have to retain a lot of humility. I was struck by how well @RamaswmySridhar is navigating this moment at @Snowflake. https://t.co/yRmsnP0R71,,https://pbs.twimg.com/media/HLmbW8_WkAA3W74.jpg,2026-06-25 03:12:17
