id,source,url,headline,abstract,img_url,publish_time
x_tweets|2063863928044790137,x_tweets,https://x.com/petergyang/status/2063863928044790137,"RT @petergyang: Most engineering processes were built for teams shipping 10 to 15 PRs a month. @kunchenguid, ex-Meta L8 engineer, is now s…",,,2026-06-08 14:01:19
wscn_news|3774087,wscn_news,https://wallstreetcn.com/articles/3774087,“你应该感到高兴！”黄仁勋力挺AI：暴跌后终于能打折买了,"全球科技股遭遇抛售，英伟达CEO黄仁勋却在首尔高呼""现在是打折买入的好时机""，并断言AI基础设施建设才刚起步，必将复制互联网崛起之路。与此同时，英伟达与SK海力士宣布签署多年协议，联合开发下一代AI内存芯片，消息提振市场情绪，恐慌性抛售势头有所缓和。",https://wpimg-wscn.awtmt.com/7b096ae4-f2dd-4f2c-8161-ab2d4ad371d2.png,2026-06-08 13:57:56
wscn_news|3774080,wscn_news,https://wallstreetcn.com/articles/3774080,英伟达与LG集团宣布共建AI工厂，覆盖机器人、数据中心、自动驾驶,英伟达与LG联手建设AI工厂。LG引入GR00T与Cosmos模型研发CLoiD家用机器人、建实体AI数据厂；结合Blackwell GPU推进韩国主权模型EXAONE商业化；并联合开发800V直流储能与液冷模块，打造涵盖车载ADAS到自主制造的统一工作流。,https://wpimg-wscn.awtmt.com/9d9c0311-2b7a-407e-b563-79f7731ee5b8.png,2026-06-08 13:56:29
x_tweets|2063855302102192196,x_tweets,https://x.com/garrytan/status/2063855302102192196,"RT @davidNbreslauer: Gbrain by @garrytan is so good, I've now moved by brain onto a dedicated server, that Codex, Claude, OpenClaw, and Her…",,,2026-06-08 13:27:03
x_tweets|2063854276729090133,x_tweets,https://x.com/garrytan/status/2063854276729090133,"RT @agupta: i agree that the frontier american models are clearly better, but it doesn't help that the evals being used are such bs that th…",,,2026-06-08 13:22:58
qbitai_news|432084,qbitai_news,https://www.qbitai.com/2026/06/432084.html,马斯克SpaceX路演PPT：60页，值1.77万亿美元,最值得看的不是火箭是AI,https://www.qbitai.com/wp-content/uploads/2026/06/34cd75cac7c0df78ddac920c1cd375a4.webp,2026-06-08 13:02:40
qbitai_news|432062,qbitai_news,https://www.qbitai.com/2026/06/432062.html,让矩阵归模拟，让逻辑归数字！这家中国团队重新定义了计算机,黄仁勋要算一万步，这家公司的芯片只需一步,https://www.qbitai.com/wp-content/uploads/2026/06/8497eebc088e4a919b73b0a8ee5a9f21.webp,2026-06-08 12:36:03
x_tweets|2063835799096090749,x_tweets,https://x.com/levie/status/2063835799096090749,"The numbers may be a bit extreme here, but unquestionably use-cases have to stratify in the next year or two between model families. We’ll see a split between frontier intelligence for high end tasks and work, and much cheaper models for high volume workloads that can sufficiently be peeled off to cheaper models. Frontier will still be far bigger than today because the use-cases will demand it, but the low-end will get quite a bit larger as well. The big update here is that the layer that can efficiently route the workload to the right model will then become increasingly valuable since that becomes one of the new hard problems in AI agents. Agent orchestration that can cost optimize while still performing the task successfully will be in a strong position.",,,2026-06-08 12:09:33
kr36_news|3844006775360002,kr36_news,https://36kr.com/p/3844006775360002,产品观察 | 小米创始员工范典创业AI硬件，做了台“无摩擦”的睡眠床头灯,不用戴手环就能检测睡眠数据。,"https://img.36krcdn.com/hsossms/20260608/v2_38028dece31040bc8e1c7bdc1fd801a8@000000_oswg34324oswg893oswg380_img_000?x-oss-process=image/resize,m_mfit,w_600,h_400,limit_0/crop,w_600,h_400,g_center",2026-06-08 12:07:08
wscn_news|3774076,wscn_news,https://wallstreetcn.com/articles/3774076,内测AI支付，微信要打通Agent关键一环,AI支付是基建一样的存在,https://wpimg-wscn.awtmt.com/985a649b-88e1-464e-b7ec-f660a2aad6b4.png,2026-06-08 11:59:46
kr36_news|3843976867989768,kr36_news,https://36kr.com/p/3843976867989768,深扒151份JD，揭秘“数据标注员”：两极分化，30倍薪水差，残酷的未来,是个好工作么,https://img.36krcdn.com/hsossms/20260608/v2_41d60892461b4ad297073b63666eb81f@5091053@ai_oswg936708oswg1053oswg495_img_png~tplv-1marlgjv7f-ai-v3:600:400:600:400:q70.jpg,2026-06-08 11:59:44
tmtpost_news|8018550,tmtpost_news,https://www.tmtpost.com/8018550.html,米哈游创始人放弃的AI表演，Seedance2.0、可灵、快乐马谁能成？｜测评,“AI戏精”三强争霸赛,https://images.tmtpost.com/uploads/images/2026/06/1e1151e903ef9c6649e622255784aefa_1780889354.png,2026-06-08 11:58:00
wscn_news|3774072,wscn_news,https://wallstreetcn.com/articles/3774072,秘密会议、高管出局、押注谷歌Gemini——新Siri能否救赎库克的最后一战？,据报道，苹果因Apple Intelligence全面落后，于2025年初召开秘密高层会议，承认存在技术、文化与领导力的系统性失败。AI负责人Giannandrea随后离职，Mike Rockwell接手Siri重建工作，并引入谷歌Gemini模型替换底层系统。库克打破惯例亲自介入AI战略。新版Siri将于WWDC亮相，被视为苹果AI反攻的首张牌。,https://wpimg-wscn.awtmt.com/23c748b0-7ed6-47a0-acd4-a43a674fd61a.png,2026-06-08 11:54:25
wscn_news|3774071,wscn_news,https://wallstreetcn.com/articles/3774071,SpaceX天价估值意味着什么？需十年增长600倍、年均营收增速50%,SpaceX即将于6月12日以1.75万亿美元估值登陆纳斯达克。据测算，若要让投资者获得约10%的年化回报，SpaceX需在2035年实现1.1万亿美元营收，这意味着未来十年年均增速须维持50%，增幅约600倍。而SpaceX目前年营收仅187亿美元，且处于亏损状态。,https://wpimg-wscn.awtmt.com/1ff71a7b-153c-4573-8b2c-3101df2892d1.png,2026-06-08 11:50:19
tmtpost_news|8018527,tmtpost_news,https://www.tmtpost.com/8018527.html,汤道生明确了一件事：腾讯AI先谈产品，再谈生意,腾讯还在死磕产品。,https://images.tmtpost.com/uploads/images/2026/06/f01c02a6e72004af76151a526bdbb68b_1780882774.png,2026-06-08 11:48:00
x_tweets|2063829369949467050,x_tweets,https://x.com/nikunj/status/2063829369949467050,"Given all the “loops” conversation, @Apple has the chance (and address) to do the funniest thing at WWDC.. https://t.co/HAhOpSW5Pn",,https://pbs.twimg.com/media/HKQx3-XaMAEoWeJ.jpg,2026-06-08 11:44:00
wscn_news|3774073,wscn_news,https://wallstreetcn.com/articles/3774073,报道：月之暗面启动新一轮融资、剑指300亿美元估值，半年估值翻七倍,月之暗面正启动新一轮融资，目标估值300亿美元，拟筹集最多20亿美元，谈判处于早期阶段。此时由美团领投的200亿美元估值上一轮尚未交割。若本轮成功，估值将较去年12月增长约七倍。公司4月ARR已突破2亿美元，两个月内实现翻倍，是密集融资的核心支撑。,https://wpimg-wscn.awtmt.com/e8e9f397-eb8b-43ce-99c5-eb140b6a816f.png,2026-06-08 11:30:41
qbitai_news|432055,qbitai_news,https://www.qbitai.com/2026/06/432055.html,高通点赞广汽埃安N60智驾大赛获亚军，文远知行WRD 3.0亮相高通峰会,文远知行携L2++ 一段式端到端方案WRD 3.0参展,https://www.qbitai.com/wp-content/uploads/2026/06/weride图片1.png,2026-06-08 11:17:35
tmtpost_news|8018466,tmtpost_news,https://www.tmtpost.com/8018466.html,人类首次成为网络少数派：赢家输家清单与组织重构指南,人类首次成为网络少数派——57.4%的流量来自机器。AI正在改写安全规则、压缩商业漏斗、瓦解科层制。谁在赢、谁在输、组织如何重构？,https://images.tmtpost.com/uploads/images/2026/06/23c273106b12fed6352b953aa13f184e_1780886598.png,2026-06-08 11:15:46
x_tweets|2063820440800530905,x_tweets,https://x.com/garrytan/status/2063820440800530905,"RT @sdianahu: beyond model size, the more interesting frontier is a thin layer on top: a coding agent that writes an executable world model…",,,2026-06-08 11:08:31
x_tweets|2063819323106615434,x_tweets,https://x.com/petergyang/status/2063819323106615434,"Ok ChatGPT had a good one: Wife: ""I did, the loop is called marriage and this is your daily cron job.""",,,2026-06-08 11:04:05
x_tweets|2063818032280170721,x_tweets,https://x.com/petergyang/status/2063818032280170721,"My wife asked me to take out the trash. I said, “You shouldn’t be prompting me anymore. You should be designing loops."" Finish the punch line of this dad joke please.",,,2026-06-08 10:58:57
x_tweets|2063817219906130355,x_tweets,https://x.com/sama/status/2063817219906130355,RT @mbacarella: AI causes psychosis in people who don't use it,,,2026-06-08 10:55:43
x_tweets|2063816763658117566,x_tweets,https://x.com/sama/status/2063816763658117566,"The government having a monopoly on organized/ccoordinated violence? A good thing that we ned mor of(no reason we can't stop most family/church ""intervntions""/eotional violence! Trying to get a monopoly/keeping a lid on all violence? Obviously a reccipe for totalitarian overeach.",,,2026-06-08 10:53:54
kr36_news|3843930550421760,kr36_news,https://36kr.com/p/3843930550421760,SpaceX、OpenAI、Anthropic上市，AI时代的“阿波罗时刻”到了,我们正站在“智能奇点”的前夜。,https://img.36krcdn.com/hsossms/20260608/v2_66592379366e450a89ddf0abf87b811c@5091053@ai_oswg1074815oswg1053oswg495_img_png~tplv-1marlgjv7f-ai-v3:600:400:600:400:q70.jpg,2026-06-08 10:52:50
kr36_news|3843921641736457,kr36_news,https://36kr.com/p/3843921641736457,Chat已死，GPT史上最大改版，不只聊天,OpenAI亲口宣判「Chat is dead」！ChatGPT即将迎来上线以来最大改版，聊天框消失，Codex上位，Agent全面接管。,https://img.36krcdn.com/hsossms/20260608/v2_5ace0ef882694ccba8384301992ec5fc@5091053@ai_oswg1004970oswg1053oswg495_img_png~tplv-1marlgjv7f-ai-v3:600:400:600:400:q70.jpg,2026-06-08 10:52:29
kr36_news|3843922067868162,kr36_news,https://36kr.com/p/3843922067868162,降维打击，数学博士熬秃头，AI数学家：上午出题，下午4点交证明,数学还是人类最后智力上的荣耀吗？,https://img.36krcdn.com/hsossms/20260608/v2_5e094a30cee44439a1bc9f1ecfde3367@5091053@ai_oswg999921oswg1053oswg495_img_png~tplv-1marlgjv7f-ai-v3:600:400:600:400:q70.jpg,2026-06-08 10:52:14
x_tweets|2063816164279496781,x_tweets,https://x.com/sama/status/2063816164279496781,RT @Heroine__P_: Mormonism is a cult,,,2026-06-08 10:51:32
tmtpost_news|8018428,tmtpost_news,https://www.tmtpost.com/8018428.html,聊天已死：OpenAI亲手终结ChatGPT,对话框时代结束了？,https://images.tmtpost.com/uploads/images/2026/06/20260608104254202.png,2026-06-08 10:49:00
wscn_news|3774068,wscn_news,https://wallstreetcn.com/articles/3774068,全球大行正“达成共识”：随着AI普及，裁员不可避免，尤其是中台和入门岗位,摩根大通、花旗、高盛、渣打等投行CEO均表示裁员不可避免，各大银行正将初级分析师招募规模削减最多三分之二，应届生入行通道收窄。目前AI部署仍以单点场景为主，全面替代尚早，但行业整体趋势已从人力扩张转向技术增效。,https://wpimg-wscn.awtmt.com/4eb91313-9d73-4b3e-9a51-09c724ca63f3.jpeg,2026-06-08 10:44:24
wscn_news|3774064,wscn_news,https://wallstreetcn.com/articles/3774064,博通大跌之际，这家投行放出“大卫星”：渠道调研显示2028年谷歌TPU出货量将达3500万颗，远超预期！,瑞穗最新调研强烈看多博通，预测2028年谷歌TPU出货将达炸裂的3500万颗。由于博通是谷歌TPU的ASIC设计合作方，TPU出货量直接对应其业务收入。但该数据高达全行业总预测量的2.3倍，因严重脱离供应链现实遭业内质疑：莫不是实习生用AI跑出的假结果？,https://wpimg-wscn.awtmt.com/789aa808-e3d1-425c-8165-6edbfa212926.jpeg,2026-06-08 10:41:03
tmtpost_news|8018347,tmtpost_news,https://www.tmtpost.com/8018347.html,七模型同题竞技，2026 高考作文AI大测试,2026全国一卷高考作文，七模型同题竞技,https://images.tmtpost.com/uploads/images/2026/06/14d3965e83976c830ba9d934554d5067_1780885636.png,2026-06-08 10:40:00
wscn_news|3774066,wscn_news,https://wallstreetcn.com/articles/3774066,AI双雄IPO竞速：Anthropic领跑递表，但先到终点未必先赢,Anthropic近日正式提交IPO申请，在与OpenAI的上市竞赛中率先出手。但历史数据显示，先上市并不保证股价更优——Lyft先于Uber上市，一年后却多跌了近一半。IPO顾问指出，这场竞速的核心是抢夺资本：若两家公司各售出5%股份，合计融资规模将达约1000亿美元。,https://wpimg-wscn.awtmt.com/ed427db2-7cba-4563-a0f6-a29b4effb83a.jpeg,2026-06-08 10:23:25
x_tweets|2063808349133799521,x_tweets,https://x.com/petergyang/status/2063808349133799521,"RT @petergyang: ""If you're still manually reviewing every line of code, you're the bottleneck."" Here's my new episode with @kunchenguid, a…",,,2026-06-08 10:20:28
kr36_news|3843832002971905,kr36_news,https://36kr.com/p/3843832002971905,智谱与MiniMax回A遭遇“七月围城”,2026年港股解禁规模高达1.55万亿港元，较2025年约6000亿港元猛增近3倍，创下有记录以来的年度解禁新高。在这轮解禁潮中，智谱与MiniMax尤其值得关注。,https://img.36krcdn.com/hsossms/20260608/v2_0414c69b52254ec5b40a70807c1c3e06@5091053@ai_oswg1046650oswg1053oswg495_img_png~tplv-1marlgjv7f-ai-v3:600:400:600:400:q70.jpg,2026-06-08 09:51:03
kr36_news|3843856818030852,kr36_news,https://36kr.com/p/3843856818030852,“锈带”变“智带”：美国宾州凭什么拿下 900 亿美元 AI 注资,“旧工业基础设施”与“新算力需求”之间的隐秘契合，是锈带重生的真正起点。,https://img.36krcdn.com/hsossms/20260608/v2_923062153d744557898d89cbd0560432@5091053@ai_oswg1090028oswg1053oswg495_img_png~tplv-1marlgjv7f-ai-v3:600:400:600:400:q70.jpg,2026-06-08 09:50:43
kr36_news|3842559523850504,kr36_news,https://36kr.com/p/3842559523850504,AI真能学会心算？隐式思维链首次得到理论证明，Stuart Russell参与,UC Berkeley用数学证明了隐式思维链的可行性,https://img.36krcdn.com/hsossms/20260608/v2_54eaf6168aad4ebfbd39a7c21343b5c7@5091053@ai_oswg1045588oswg1053oswg495_img_png~tplv-1marlgjv7f-ai-v3:600:400:600:400:q70.jpg,2026-06-08 09:45:14
github_trending|refactoringhq/tolaria,github_trending,https://github.com/refactoringhq/tolaria,refactoringhq/tolaria,"Desktop app to manage markdown knowledge bases 💧 Tolaria Tolaria is a desktop app for macOS, Windows, and Linux for managing markdown knowledge bases. People use it for a variety of use cases: Operate second brains and personal knowledge Organize company docs as context for AI Store OpenClaw/assistants memory and procedures Personally, I use it to run my life (hey 👋 Luca here). I have a massive workspace of 10,000+ notes, which are the result of my Refactoring work + a ton of personal journaling and second braining. Walkthroughs You can find some Loom walkthroughs below — they are short and to the point: How I Organize My Own Tolaria Workspace My Inbox Workflow How I Save Web Resources to Tolaria Principles 📑 Files-first — Your notes are plain markdown files. They're portable, work with any editor, and require no export step. Your data belongs to you, not to any app. 🔌 Git-first — Every vault is a git repository. You get full version history, the ability to use any git remote, and zero dependency on Tolaria servers. 🛜 Offline-first, zero lock-in — No accounts, no subscriptions, no cloud dependencies. Your vault works completely offline and always will. If you...",https://opengraph.githubassets.com/26292879140981ede88ef625008cd425cec1f30d16292f5062e1eaef458c81a6/refactoringhq/tolaria,2026-06-08 09:44:56
github_trending|opencv/opencv,github_trending,https://github.com/opencv/opencv,opencv/opencv,"Open Source Computer Vision LibraryOpenCV: Open Source Computer Vision Library Resources Homepage: https://opencv.org Courses: https://opencv.org/courses Docs: https://docs.opencv.org/4.x/ Q&amp;A forum: https://forum.opencv.org previous forum (read only): http://answers.opencv.org Issue tracking: https://github.com/opencv/opencv/issues Additional OpenCV functionality: https://github.com/opencv/opencv_contrib Donate to OpenCV: https://opencv.org/support/ Contributing Please read the contribution guidelines before starting work on a pull request. Summary of the guidelines: One pull request per issue; Choose the right base branch; Include tests and documentation; Clean up ""oops"" commits before submitting; Follow the coding style guide. Additional Resources Submit your OpenCV-based project for inclusion in Community Friday on opencv.org Subscribe to the OpenCV YouTube Channel featuring OpenCV Live, an hour-long streaming show Follow OpenCV on LinkedIn for daily posts showing the state-of-the-art in computer vision &amp; AI Apply to be an OpenCV Volunteer to help organize events and online campaigns as well as amplify them Follow OpenCV on Mastodon in the Fediverse Follow OpenCV on Twitter OpenCV.ai: Computer Vision and AI development services from the OpenCV team.",https://opengraph.githubassets.com/96228e6545b0e3a16c7ccc62885fb08676c14570bbf5b697ec6fa8b72cf2955e/opencv/opencv,2026-06-08 09:44:56
github_trending|openai/plugins,github_trending,https://github.com/openai/plugins,openai/plugins,"OpenAI PluginsPlugins This repository contains a curated collection of Codex plugin examples. Each plugin lives under plugins/&lt;name&gt;/ with a required .codex-plugin/plugin.json manifest and optional companion surfaces such as skills/, .app.json, .mcp.json, plugin-level agents/, commands/, hooks.json, assets/, and other supporting files. Highlighted richer examples in this repo include: plugins/figma for use_figma, Code to Canvas, Code Connect, and design system rules plugins/notion for planning, research, meetings, and knowledge capture plugins/build-ios-apps for SwiftUI implementation, refactors, performance, and debugging plugins/build-macos-apps for macOS SwiftUI/AppKit workflows, build/run/debug loops, and packaging guidance plugins/build-web-apps for deployment, UI, payments, and database workflows plugins/expo for Expo and React Native apps, SDK upgrades, EAS workflows, and Codex Run actions plugins/netlify, plugins/remotion, and plugins/google-slides for additional public skill- and MCP-backed plugin bundles",https://opengraph.githubassets.com/75e3d9073772dcd0668f397fd0e4f43e238918104014ac5d1dba9bb95ef6964f/openai/plugins,2026-06-08 09:44:56
github_trending|mvanhorn/last30days-skill,github_trending,https://github.com/mvanhorn/last30days-skill,mvanhorn/last30days-skill,"AI agent skill that researches any topic across Reddit, X, YouTube, HN, Polymarket, and the web - then synthesizes a grounded summary/last30days An AI agent-led search engine scored by upvotes, likes, and real money - not editors. This README tracks the current v3 pipeline. The runtime skill spec lives in skills/last30days/SKILL.md, which is the source of truth for the latest command and setup behavior. Claude Code (recommended — auto-updates via marketplace): /plugin marketplace add mvanhorn/last30days-skill /plugin install last30days Codex, Cursor, Copilot, Gemini CLI, or any of 50+ Agent Skills hosts: npx skills add mvanhorn/last30days-skill -g (-g installs globally for your user, available across all projects. Drop it to scope per-project.) More install options (claude.ai web, OpenClaw, manual) in the Install section below. Zero config. Reddit, HN, Polymarket, and GitHub work immediately. Run it once and the setup wizard unlocks X, YouTube, TikTok, and more in 30 seconds. Reddit upvotes. X likes. YouTube transcripts. TikTok engagement. Polymarket odds backed by real money and insider information. That's millions of people voting with their attention and their wallets every day. /last30days searches all of it in parallel, scores it by what real people actually engage with, and an AI agent judge synthesizes it...",https://opengraph.githubassets.com/748a3563f68543da37488d3d3299a789672af18b0f95fe9b6cfceb05078b46f9/mvanhorn/last30days-skill,2026-06-08 09:44:56
github_trending|microsoft/pg_durable,github_trending,https://github.com/microsoft/pg_durable,microsoft/pg_durable,"PostgreSQL in-database durable execution Website · Docs · Quick Example · GitHub Durable Execution inside PostgreSQL Long-running, fault-tolerant SQL functions for teams that already keep their state in Postgres and want to stop stitching together cron jobs, workers, queues, and status tables to make background work reliable. Define the workflow in SQL, let pg_durable checkpoint each step, and resume after crashes, restarts, or failed steps. Durable execution is now a standard industry pattern, and pg_durable brings it inside Postgres with no extra service infrastructure required. Part of our mission to bring compute close to data. Try pg_durable now in Azure HorizonDB, Microsoft's new PostgreSQL cloud service engineered for performance and built with pg_durable inside Is this for me? Who it's for Backend and data engineers who want workflows to live next to the data they touch. DBAs and SREs automating runbooks that must survive restarts and be auditable in SQL. Teams building data or AI pipelines that need durable execution per row, document, or batch. The core idea A pg_durable function is a graph of SQL steps that PostgreSQL executes and checkpoints as it goes. If the database crashes, restarts, or a step fails, execution resumes from the last durable...",https://opengraph.githubassets.com/e5d3fb88b82b2e12c83801abff5b3261ad2b1ad8067d33ca60a016dd2a8206ef/microsoft/pg_durable,2026-06-08 09:44:56
github_trending|lfnovo/open-notebook,github_trending,https://github.com/lfnovo/open-notebook,lfnovo/open-notebook,"An Open Source implementation of Notebook LM with more flexibility and features Open Notebook An open source, privacy-focused alternative to Google's Notebook LM! Join our Discord server for help, to share workflow ideas, and suggest features! Checkout our website » 📚 Get Started · 📖 User Guide · ✨ Features · 🚀 Deploy Deutsch | Español | français | 日本語 | 한국어 | Português | Русский | 中文 A private, multi-model, 100% local, full-featured alternative to Notebook LM In a world dominated by Artificial Intelligence, having the ability to think 🧠 and acquire new knowledge 💡, is a skill that should not be a privilege for a few, nor restricted to a single provider. Open Notebook empowers you to: 🔒 Control your data - Keep your research private and secure 🤖 Choose your AI models - Support for 18+ providers including OpenAI, Anthropic, Ollama, LM Studio, and more 📚 Organize multi-modal content - PDFs, videos, audio, web pages, and more 🎙️ Generate professional podcasts - Advanced multi-speaker podcast generation 🔍 Search intelligently - Full-text and vector search across all your content 💬 Chat with context - AI conversations powered by your research 🌐 Multi-language UI - English, Portuguese, Chinese (Simplified...",https://repository-images.githubusercontent.com/876286167/a086d43b-112b-4c10-91f5-5c3fd71c9af9,2026-06-08 09:44:56
