id,source,url,headline,abstract,img_url,publish_time
x_tweets|2069855178812215550,x_tweets,https://x.com/swyx/status/2069855178812215550,RT @e2b: Our own Matt Brockman is hosting a workshop on top 5 sandbox failure modes and how to address them at AI Engineer! Catch his work…,,,2026-06-25 02:48:25
ifanr_news|1669726,ifanr_news,https://www.ifanr.com/1669726,苹果新 CEO 想找回「果味」，但苹果设计已经遍地开花,一鲸落，万物生,https://s3.ifanr.com/wp-content/uploads/2026/06/cover-6-1024x682.jpg,2026-06-25 01:52:41
x_tweets|2069830172354986418,x_tweets,https://x.com/ryolu_/status/2069830172354986418,use cursor in notion use notion in cursor,,,2026-06-25 01:09:03
techcrunch_news|3136032,techcrunch_news,https://techcrunch.com/2026/06/24/europe-is-pushing-back-on-washingtons-chip-war,Europe is pushing back on Washington's chip war,"As ASML CEO Christophe Fouquet told TechCrunch in May, what China can currently buy are older-generation deep ultraviolet tools — gear first shipped about a decade ago — the same machines the MATCH Act would now put off-limits.",,2026-06-25 01:08:36
x_tweets|2069827839826809042,x_tweets,https://x.com/GoogleLabs/status/2069827839826809042,"We are honored to share that Project Genie has won the Cannes Lions Grand Prix for AI Craft! 🏆 To our awesome Labs community, thank you for being on this journey with us!",,,2026-06-25 00:59:47
x_tweets|2069825206710112758,x_tweets,https://x.com/swyx/status/2069825206710112758,RT @thejoycezhang: One of my big dreams when I first started out was to teach engineers to talk about their feelings at massive scale at Dr…,,,2026-06-25 00:49:19
x_tweets|2069819652365242765,x_tweets,https://x.com/rauchg/status/2069819652365242765,The data of tokens and uptime recovered by @vercel AI Gateway is truly astonishing,,,2026-06-25 00:27:15
techcrunch_news|3135964,techcrunch_news,https://techcrunch.com/2026/06/24/former-infosys-chief-has-a-new-startup-that-wants-to-challenge-the-it-services-world,Former Infosys chief has a new startup that wants to challenge the IT services world,"Backed by Mayfield and Aramco Ventures, Vishal Sikka’s new venture brings together veterans from SAP, Infosys, and VianAI.",https://techcrunch.com/wp-content/uploads/2026/06/vishal-sikka-indiaai-summit.jpg,2026-06-25 00:26:52
x_tweets|2069817246671851686,x_tweets,https://x.com/adityaag/status/2069817246671851686,A space economy doesn't just need rockets and space guns. It needs ways to communicate as efficiently as we do on the ground. Very excited about the work Qosmic is doing.,,,2026-06-25 00:17:41
x_tweets|2069816929448251871,x_tweets,https://x.com/adityaag/status/2069816929448251871,RT @Jain_Shrey_: We've raised $3.33 Million to build the Optical highway to the Cosmos. Led by @AccelIndia and @Prosus_Ventures and given…,,,2026-06-25 00:16:25
verge_news|dmcyOnBvc3Q6OTU1ODMx,verge_news,https://www.theverge.com/tech/955831/figma-code-design-tools-config-2026-announcements,Figma now has AI motion graphics and shader tools,"You can also work directly with code on the Figma Design canvas, thanks to code layers.","https://platform.theverge.com/wp-content/uploads/sites/2/2026/06/Figma-config-2026.jpg?quality=90&strip=all&crop=0,0,100,100",2026-06-25 00:15:00
wscn_news|3775436,wscn_news,https://wallstreetcn.com/articles/3775436,2.3万亿美元！日本推出14年超级投资计划，近1/3押注AI半导体,日本公布截至2040财年的14年超级投资计划，总额逾370万亿日元（约2.3万亿美元），其中近三分之一（101.6万亿日元）押注AI与半导体。计划旨在借“芯片+AI”产业链应对老龄化、提振经济增长。但财政可持续性高度依赖增长实绩，在扩张性支出与利率上行双重压力下，这场押注增长与财政平衡的长期考验已然开启。,https://wpimg-wscn.awtmt.com/1f65762a-08ba-4fbb-8bfc-e756d15ab24a.jpeg,2026-06-25 00:03:55
ifanr_news|1669906,ifanr_news,https://www.ifanr.com/1669906,早报｜今年手机平均售价或升至3800元/OpenAI发布首款芯片/68元起，豆包专业版正式上线,· 2.99 万元起，宇树 R1 人形机器人官宣降价 · 海力士拟赴美上市募资 294 亿美元 · 曝特斯拉中国车机将接入豆包,https://s3.ifanr.com/images/ep/cover-images/ta_qian_de_nv_ren_cover.jpg,2026-06-25 00:03:26
x_tweets|2069808188480704987,x_tweets,https://x.com/sama/status/2069808188480704987,"This is true. The hustle culture minorities who vote for more free market/""moderate"" demcrats and white socon poors who vote republican are stealing everyone's money.",,,2026-06-24 23:41:41
techcrunch_news|3135956,techcrunch_news,https://techcrunch.com/2026/06/24/cerebras-stock-plunges-after-earnings-as-ceo-says-margin-outlook-was-misunderstood,Cerebras stock plunges after earnings as CEO says margin outlook was misunderstood,"In its first earnings report since going public, the AI chipmaker forecast a narrower gross margin in its core business, scaring investors.",,2026-06-24 23:41:41
x_tweets|2069806049847321020,x_tweets,https://x.com/garrytan/status/2069806049847321020,"We aren’t doing this trash in San Francisco because we saw what these kinds of ruthless politicians do to the citizens Asian elders killed Public education dismantled If you start counting their bodies and talking about their abdication of duty, the hard left can’t win",,,2026-06-24 23:33:12
x_tweets|2069805585479114806,x_tweets,https://x.com/danshipper/status/2069805585479114806,YouTube: https://t.co/O8njShLFWB Spotify: https://t.co/U3R2F9rSYS,,,2026-06-24 23:31:21
x_tweets|2069805581263847467,x_tweets,https://x.com/danshipper/status/2069805581263847467,"Are we hurtling toward a future where AI can do everything humans can? Edwin Chen (@echen) believes we might be. He’s the CEO of Surge AI, one of the largest providers of expert data for frontier labs. Surge passed over $1 billion in revenue without raising any outside capital, and that gives Edwin a unique perspective on how quickly AI progress is accelerating. I’m on the record arguing that AI automation actually creates more human work. I also believe that even though AI progress is accelerating exponentially, we’re much farther away from AI replacing humans than it might seem. That’s why I had Edwin on @every’s AI & I. We batted around different visions of the future, and discussed whether humanity will retain its unique place in the universe, and what that might be. We get into: • If Chen’s version of the future materializes, he’s worried it’ll make people stop trying. One answer comes from a short story by science fiction writer Ted Chiang: Behave as if your decisions matter, even when you know they don’t. • AI may soon be able to take a nebulous goal like “win a Fields Medal” and execute. What it can’t do, I argue, is set its own goals—LLMs have no intrinsic motivation, no drive to explore, no ability to just change their mind. • A model optimized for engagement doesn’t provide the most valuable user experience. Edwin spent 20 rounds polishing a pointless email with one model before Claude told him to just send it. • Why AI is still bad at writing: models learn to hack the metrics they're trained on. Edwin's Hemingway Bench found models outputting a metaphor in every single sentence, an overindexxing that makes for a terrible reading experience. This is a must-watch for anyone interested in where we fit as models get more capable. Watch below! Timestamps 1. Introduction: 00:00:54 2. Surge as a ""school for AGI"": 00:01:49 3. What AI's capacity for novel mathematics says about human achievement: 00:04:46 4. Motivation in an era when AI can do everything: 00:07:29 5. The trap of optimizing AI models for engagement: 00:14:34 6. Training using datasets versus training using environments: 00:29:34 7. The value of personal data: 00:35:09 8. Why models are bad at writing: 00:39:40 9. Chen's AGI timeline: 00:42:00",,https://pbs.twimg.com/amplify_video_thumb/2069800653497552896/img/bRrIBGuL1UD5xN3l.jpg,2026-06-24 23:31:20
x_tweets|2069805276564472108,x_tweets,https://x.com/petergyang/status/2069805276564472108,"If you enjoyed the free course, I also spent 20+ hours writing 17 opinionated lessons that cover my complete personal Hermes setup. It's available in my members-only portal at https://t.co/rVbbu5NZDU. Check it out! https://t.co/wSEGlGQvkf",,https://pbs.twimg.com/media/HLls7hlaQAAV-UV.jpg,2026-06-24 23:30:07
x_tweets|2069805257513980158,x_tweets,https://x.com/petergyang/status/2069805257513980158,"I love using Hermes from @NousResearch as my 24/7 AI chief of staff because it's reliable, free, and open source. Here's my new 45-minute free course that covers how to: → Install Hermes safely → Connect Telegram, voice, Google Workspace, and more → Create routines like morning briefing, business review, and health check 📌 Watch the full course now: https://t.co/hpo2i73auX",,,2026-06-24 23:30:03
x_tweets|2069803483423994361,x_tweets,https://x.com/swyx/status/2069803483423994361,happy karpathy agent day for those who celebrate,,,2026-06-24 23:23:00
x_tweets|2069803472996941959,x_tweets,https://x.com/nikunj/status/2069803472996941959,"The easiest way to figure out what you are TRULY excellent at is to notice what looks like child’s play to you but is very hard for those around you.. That’s your edge. If you can use that, tenacity and combine it with a large market, then magic follows 🪄",,,2026-06-24 23:22:57
techcrunch_news|3135912,techcrunch_news,https://techcrunch.com/2026/06/24/ai-was-supposed-to-kill-engineering-jobs-but-new-data-suggests-theyre-the-most-resilient,"AI was supposed to kill engineering jobs, but new data suggests they're the most resilient","While AI dominates the layoff narrative, engineers are actually making up a larger share of new hires, according to SignalFire data.",,2026-06-24 22:56:41
techcrunch_news|3135911,techcrunch_news,https://techcrunch.com/2026/06/24/ai-researchers-continue-to-leave-google-for-its-rivals,AI researchers continue to leave Google for its rivals,"Top AI researchers Jonas Adler and Alexander Pritzel are leaving Google for Anthropic, following departures from top scientists Noam Shazeer and John Jumper.",,2026-06-24 22:42:07
verge_news|dmcyOnBvc3Q6OTU1OTM5,verge_news,https://www.theverge.com/ai-artificial-intelligence/955939/openai-reveals-its-first-ai-processor-jalapeno,OpenAI reveals its first AI processor: Jalapeño,OpenAI’s first custom chip is made for the servers processing ChatGPT requests.,"https://platform.theverge.com/wp-content/uploads/sites/2/2026/06/openai-broadcom-jalapeno-inference-chip-image.webp?quality=90&strip=all&crop=7.7734375,0,84.453125,100",2026-06-24 22:36:47
techcrunch_news|3135900,techcrunch_news,https://techcrunch.com/2026/06/24/the-memory-chip-crunch-is-paying-off-for-this-u-s-company,The memory chip crunch is paying off for this US company,"Revenue quadrupled to $41.45 billion compared with the same period a year ago. The company&#8217;s profit, meanwhile, rose from $1.88 billion to an incredible $28.2 billion year-over-year.",https://techcrunch.com/wp-content/uploads/2026/06/micron-HQ-GettyImages-2147904174.jpg,2026-06-24 22:30:55
techcrunch_news|3135849,techcrunch_news,https://techcrunch.com/2026/06/24/companies-are-scrambling-to-stop-employees-from-maxing-out-ai-budgets-with-small-tasks,Companies are scrambling to stop employees from maxing out AI budgets with small tasks,The tokenmaxxing era was brief. We now appear to be entering the era of token rationing.,,2026-06-24 21:09:45
verge_news|dmcyOnBvc3Q6OTU1NTM3,verge_news,https://www.theverge.com/gadgets/955537/google-home-smart-speaker-hands-on,The Google Home Speaker sounds good and looks great — but it’s finicky,"For such a small speaker, Google’s $99 device packs a punch. But ‘speaker’ is only the beginning of the job.","https://platform.theverge.com/wp-content/uploads/sites/2/2026/06/Google-Home-Speaker.jpg?quality=90&strip=all&crop=0.00534644995723,0,99.989307100086,100",2026-06-24 21:00:00
techcrunch_news|3135724,techcrunch_news,https://techcrunch.com/2026/06/24/facebook-rolls-out-an-ai-companion-app-for-creators,Facebook rolls out an AI companion app for creators,"The new app, which is currently being tested with select creators, will have Facebook&#8217;s recently launched AI creator assistant built into it.",,2026-06-24 18:16:24
qbitai_news|438198,qbitai_news,https://www.qbitai.com/2026/06/438198.html,“AI填志愿”成高考后新现象，超1400万人在和千问聊高考,现在仅需几分钟，就能生成一份志愿报告,https://www.qbitai.com/wp-content/uploads/2026/06/f6e35d10a61dfe678faa3fa96749de88.png,2026-06-24 18:13:28
techcrunch_news|3135736,techcrunch_news,https://techcrunch.com/2026/06/24/agility-robotics-plans-to-go-public-via-spac-in-a-2-5b-deal,Agility Robotics plans to go public via SPAC in a $2.5B deal,"Agility Robotics, the humanoid robotics startup that spun out of Oregon State University in 2015, expects to generate $620 million in proceeds.",,2026-06-24 17:48:43
techcrunch_news|3135624,techcrunch_news,https://techcrunch.com/2026/06/24/figma-adds-code-layers-support-for-animations-more-ai-features-in-new-update,"Figma adds code layers, support for animations, more AI features in new update","Figma&#8217;s update adds a new code layer, support for motion and shaders, and the ability to create custom plug-ins for various tasks using AI.",https://techcrunch.com/wp-content/uploads/2026/06/Config-product-feat.jpg,2026-06-24 17:15:00
